company_id,company_name,company_profile_url,country,city,address,website,phone,contact_person,contact_designation,member_status,member_since,verified,verification_details,legal_entity,established_year,primary_business,role,products_listed_count,deal_focus,description,search_terms,category_types,search_tab,scrape_date
3332079,A K Samy Enterprise,https://www.go4worldbusiness.com/member/view/3332079/a-k-samy-enterprise.html,Malaysia,Klang,NULL,NULL,NULL,NULL,NULL,NULL,NULL,NULL,NULL,NULL,NULL,NULL,NULL,NULL,NULL,NULL,Acesulfame-K,Acesulfame,suppliers,2026-07-20
1434954,Q&k fashion,https://www.go4worldbusiness.com/member/view/1434954/q-k-fashion.html,Malaysia,Kl,NULL,NULL,NULL,NULL,NULL,NULL,NULL,NULL,NULL,NULL,NULL,NULL,NULL,NULL,NULL,NULL,Acesulfame-K,Acesulfame,suppliers,2026-07-20
4135366,W & K Company,https://www.go4worldbusiness.com/member/view/4135366/w-k-company.html,Malaysia,Kanowit,NULL,NULL,NULL,NULL,NULL,NULL,NULL,NULL,NULL,NULL,NULL,NULL,NULL,NULL,NULL,NULL,Acesulfame-K,Acesulfame,suppliers,2026-07-20
3997064,W & K Company,https://www.go4worldbusiness.com/member/view/3997064/w-k-company.html,Malaysia,Kuala Lumpur,NULL,NULL,NULL,NULL,NULL,NULL,NULL,NULL,NULL,NULL,NULL,NULL,NULL,NULL,NULL,NULL,Acesulfame-K,Acesulfame,suppliers,2026-07-20
2771123,Cross Protection,https://www.go4worldbusiness.com/member/view/2771123/cross-protection.html,Malaysia,Klang,NULL,NULL,NULL,NULL,NULL,NULL,NULL,NULL,NULL,NULL,NULL,NULL,NULL,NULL,NULL,NULL,Acesulfame-K,Acesulfame,suppliers,2026-07-20
4467242,N K Interprises,https://www.go4worldbusiness.com/member/view/4467242/n-k-interprises.html,Malaysia,NULL,NULL,NULL,NULL,NULL,NULL,NULL,NULL,NULL,NULL,NULL,NULL,NULL,NULL,NULL,NULL,NULL,Acesulfame-K,Acesulfame,companies,2026-07-20
1540334,Q&K Fashion,https://www.go4worldbusiness.com/member/view/1540334/q-k-fashion.html,Malaysia,Kuala Lumpur,NULL,NULL,NULL,NULL,NULL,NULL,NULL,NULL,NULL,NULL,NULL,NULL,NULL,NULL,NULL,NULL,Acesulfame-K,Acesulfame,companies,2026-07-20
1557299,V&K Enterprise,https://www.go4worldbusiness.com/member/view/1557299/v-k-enterprise.html,Malaysia,Sepang,NULL,NULL,NULL,NULL,NULL,NULL,NULL,NULL,NULL,NULL,NULL,NULL,NULL,NULL,NULL,NULL,Acesulfame-K,Acesulfame,companies,2026-07-20
817652,K And M Industries Sdn.Bhd,https://www.go4worldbusiness.com/member/view/817652/k-and-m-industries-sdn-bhd.html,Malaysia,Perak,NULL,NULL,NULL,NULL,NULL,NULL,NULL,NULL,NULL,NULL,NULL,NULL,NULL,NULL,NULL,NULL,Acesulfame-K,Acesulfame,companies,2026-07-20
146584,K-Pintar Sdn Bhd,https://www.go4worldbusiness.com/member/view/146584/k-pintar-sdn-bhd.html,Malaysia,Kuala Lumpur,NULL,NULL,NULL,NULL,NULL,NULL,NULL,NULL,NULL,NULL,NULL,NULL,NULL,NULL,NULL,NULL,Acesulfame-K,Acesulfame,companies,2026-07-20
898721,L & K Optical Supplier,https://www.go4worldbusiness.com/member/view/898721/l-k-optical-supplier.html,Malaysia,Kuala Lumpur,NULL,NULL,NULL,NULL,NULL,NULL,NULL,NULL,NULL,NULL,NULL,NULL,NULL,NULL,NULL,NULL,Acesulfame-K,Acesulfame,companies,2026-07-20
1436625,T&K Asia Trading,https://www.go4worldbusiness.com/member/view/1436625/t-k-asia-trading.html,Malaysia,Batu Pahat,NULL,NULL,NULL,NULL,NULL,NULL,NULL,NULL,NULL,NULL,NULL,NULL,NULL,NULL,NULL,NULL,Acesulfame-K,Acesulfame,companies,2026-07-20
3014866,K Marshine Sdn Bhd,https://www.go4worldbusiness.com/member/view/3014866/k-marshine-sdn-bhd.html,Malaysia,Kuala Lumpur,NULL,NULL,NULL,NULL,NULL,NULL,NULL,NULL,NULL,NULL,NULL,NULL,NULL,NULL,NULL,NULL,Acesulfame-K,Acesulfame,companies,2026-07-20
1606782,V And K Auto Parts,https://www.go4worldbusiness.com/member/view/1606782/v-and-k-auto-parts.html,Malaysia,Shah Alam,NULL,NULL,NULL,NULL,NULL,NULL,NULL,NULL,NULL,NULL,NULL,NULL,NULL,NULL,NULL,NULL,Acesulfame-K,Acesulfame,companies,2026-07-20
1308856,S K Uniq Trades,https://www.go4worldbusiness.com/member/view/1308856/s-k-uniq-trades.html,Malaysia,Klang,NULL,NULL,NULL,NULL,NULL,NULL,NULL,NULL,NULL,NULL,NULL,NULL,NULL,NULL,NULL,NULL,Acesulfame-K,Acesulfame,companies,2026-07-20
4161570,K&N Brothers Enterprise,https://www.go4worldbusiness.com/member/view/4161570/k-n-brothers-enterprise.html,Malaysia,Johor,NULL,NULL,NULL,NULL,NULL,NULL,NULL,NULL,NULL,NULL,NULL,NULL,NULL,NULL,NULL,NULL,Acesulfame-K,Acesulfame,companies,2026-07-20
4027751,K&H Frozen Enterprise,https://www.go4worldbusiness.com/member/view/4027751/k-h-frozen-enterprise.html,Malaysia,NULL,NULL,NULL,NULL,NULL,NULL,NULL,NULL,NULL,NULL,NULL,NULL,NULL,NULL,NULL,NULL,NULL,Acesulfame-K,Acesulfame,companies,2026-07-20
1548499,D&K Framework Enterprise,https://www.go4worldbusiness.com/member/view/1548499/d-k-framework-enterprise.html,Malaysia,Kota Kinabalu,NULL,NULL,NULL,NULL,NULL,NULL,NULL,NULL,NULL,NULL,NULL,NULL,NULL,NULL,NULL,NULL,Acesulfame-K,Acesulfame,companies,2026-07-20
4510933,T G K Logistics,https://www.go4worldbusiness.com/member/view/4510933/t-g-k-logistics.html,Malaysia,NULL,NULL,NULL,NULL,NULL,NULL,NULL,NULL,NULL,NULL,NULL,NULL,NULL,NULL,NULL,NULL,NULL,Acesulfame-K,Acesulfame,companies,2026-07-20
4188486,K&l Industries Sdn Bhd,https://www.go4worldbusiness.com/member/view/4188486/k-l-industries-sdn-bhd.html,Malaysia,Kuching,NULL,NULL,NULL,NULL,NULL,NULL,NULL,NULL,NULL,NULL,NULL,NULL,NULL,NULL,NULL,NULL,Acesulfame-K,Acesulfame,companies,2026-07-20
369026,Hwa Eik Trading(k) Sdn Bhd,https://www.go4worldbusiness.com/member/view/369026/hwa-eik-trading%28k%29-sdn-bhd.html,Malaysia,Alor Setar,NULL,NULL,NULL,NULL,NULL,NULL,NULL,NULL,NULL,NULL,NULL,NULL,NULL,NULL,NULL,NULL,Acesulfame-K,Acesulfame,companies,2026-07-20
513820,Straits Fish Meal (k) Sdn Bhd,https://www.go4worldbusiness.com/member/view/513820/straits-fish-meal-%28k%29-sdn-bhd.html,Malaysia,Alor Setar,NULL,NULL,NULL,NULL,NULL,NULL,NULL,NULL,NULL,NULL,NULL,NULL,NULL,NULL,NULL,NULL,Acesulfame-K,Acesulfame,companies,2026-07-20
4160142,Q&k Global Trading Sdn Bhd,https://www.go4worldbusiness.com/member/view/4160142/q-k-global-trading-sdn-bhd.html,Malaysia,KUALA LUMPUR,NULL,NULL,NULL,NULL,NULL,NULL,NULL,NULL,NULL,NULL,NULL,NULL,NULL,NULL,NULL,NULL,Acesulfame-K,Acesulfame,companies,2026-07-20
1546050,K Foil Insulation (Malaysia) Sdn Bhd,https://www.go4worldbusiness.com/member/view/1546050/k-foil-insulation-%28malaysia%29-sdn-bhd.html,Malaysia,Seberang Prai Tengah,NULL,NULL,NULL,NULL,NULL,NULL,NULL,NULL,NULL,NULL,NULL,NULL,NULL,NULL,NULL,NULL,Acesulfame-K,Acesulfame,companies,2026-07-20
1490978,K-Two Worldwide Technology Sdn Bhd,https://www.go4worldbusiness.com/member/view/1490978/k-two-worldwide-technology-sdn-bhd.html,Malaysia,Kuala Lumpur,NULL,NULL,NULL,NULL,NULL,NULL,NULL,NULL,NULL,NULL,NULL,NULL,NULL,NULL,NULL,NULL,Acesulfame-K,Acesulfame,companies,2026-07-20
4169472,North Cape Trading Sdn Bhd (1083205-k),https://www.go4worldbusiness.com/member/view/4169472/north-cape-trading-sdn-bhd-%281083205-k%29.html,Malaysia,Masai,NULL,NULL,NULL,NULL,NULL,NULL,NULL,NULL,NULL,NULL,NULL,NULL,NULL,NULL,NULL,NULL,Acesulfame-K,Acesulfame,companies,2026-07-20
1713652,Dunia Taktikal Resources,https://www.go4worldbusiness.com/member/view/1713652/dunia-taktikal-resources.html,Malaysia,Kuala Lumpur,NULL,NULL,NULL,NULL,NULL,NULL,NULL,NULL,NULL,NULL,NULL,NULL,NULL,NULL,NULL,NULL,Acesulfame-K,Acesulfame,companies,2026-07-20
3504953,Crecom Burj Group,https://www.go4worldbusiness.com/member/view/3504953/crecom-burj-group.html,Malaysia,Kuala Lumpur,NULL,NULL,NULL,NULL,NULL,NULL,NULL,NULL,NULL,NULL,NULL,NULL,NULL,NULL,NULL,NULL,Acesulfame-K,Acesulfame,companies,2026-07-20
4520953,K N Wawasan Holding S D N B H D,https://www.go4worldbusiness.com/member/view/4520953/k-n-wawasan-holding-s-d-n-b-h-d.html,Malaysia,NULL,NULL,NULL,NULL,NULL,NULL,NULL,NULL,NULL,NULL,NULL,NULL,NULL,NULL,NULL,NULL,NULL,Acesulfame-K,Acesulfame,companies,2026-07-20
3591123,Narix Global Sdn. Bhd.,https://www.go4worldbusiness.com/member/view/3591123/narix-global-sdn-bhd-.html,Malaysia,Kuala Lumpur,"J-3-13, Solaris Mont Kiara, Jalan Solaris, Mont Kiara, 50480 Kuala Lumpur, Malaysia Kuala Lumpur Malaysia",http://www.narixglobal.com,NULL,Solmaz,Senior Sales Executive,Premium,"April, 2022",yes,Company Registration Certificate Verified,Narix Global Sdn. Bhd.,2015,Manufacturer/ OEM,Supplier and Service Provider,8,"Sells Pvc resin, titanium dioxide and bitumen | Services Oem service printing own trademark design on the packaging","Narix Global Sdn. Bhd. is a junior supplier and service provider from Kuala Lumpur, Malaysia. They are a manufacturer/oem specializing in pvc resin, titanium dioxide, bitumen and clinker. They provide services such as oem service printing own trademark design on the packaging. Founded in 2015, they report annual sales of USD 25 million to USD 50 million. They list 8 products.",Adipic Acid,Adipic Acid,suppliers,2026-07-20
1413491,Gamalux Oils Sdn Bhd,https://www.go4worldbusiness.com/member/view/1413491/gamalux-oils-sdn-bhd.html,Malaysia,Klang,"No. 161B, Persiaran Pegaga Taman Bayu Perdana Klang 41200 Selangor Malaysia",http://www.gamaluxoils.com.my,NULL,Sylvester,Senior Manager,Premium,"July, 2016",NULL,NULL,Gamalux Oils Sdn Bhd,2009,Manufacturer/ OEM,Supplier,4,"Sells Palm fatty acid distillate, palm fatty matter and palm acid oil","Gamalux Oils Sdn Bhd is a junior supplier from Klang, Malaysia. They are a manufacturer/oem specializing in palm fatty acid distillate, palm fatty matter, palm acid oil and industrial grade palm oil. Founded in 2009, they report annual sales of USD 15 million to USD 25 million. They list 4 products.",Adipic Acid; Agnus Castus Extract; Agnus Castus Extract Agnusides; Agrimony Tops Extract; Alder Buckthorn Bark Extract; Alfalfa Extract,Adipic Acid; Agnus Castus Extract & Products; Agrimony Extract & Products; Alder Buckthorn Extract & Products; Alfalfa Extract & Products,suppliers,2026-07-20
1611956,Sri Jelutung Palm Oil Mill Sdn. Bhd.,https://www.go4worldbusiness.com/member/view/1611956/sri-jelutung-palm-oil-mill-sdn-bhd-.html,Malaysia,Puchong,"No. 2A, Industrial Park, Jalan Bp 4/6, Bandar Bukit Puchong, 47120 Puchong, Selangor, Malaysia Puchong 47120 Selangor Malaysia",https://www.ikhasas.com/,+60-19 368 6892,Shirlene,Sales And Marketing Manager,Premium,"August, 2018",yes,Company Registration Certificate Verified,Sri Jelutung Palm Oil Mill Sdn. Bhd.,1973,Manufacturer/ OEM,Supplier,11,Sells Crude palm oil / olien,"Sri Jelutung Palm Oil Mill Sdn. Bhd. is a junior supplier from Puchong, Malaysia. They are a manufacturer/oem specializing in crude palm oil/olien. Founded in 1973. They list 11 products.",Adipic Acid,Adipic Acid,suppliers,2026-07-20
4414100,Pure Chem Oleo,https://www.go4worldbusiness.com/member/view/4414100/pure-chem-oleo.html,Malaysia,Selangor,Port Klang Selangor 42000 Malaysia,https://www.go4worldbusiness.com/member/view/4414100/pure-chem-oleo.html,+60-17-856 9624,Ms Jeya,Sales,GOLD,"April, 2025",NULL,NULL,Pure Chem Oleo,2024,Distributor,Supplier,1,"Sells Detergent chemicals, industrial chemicals and glycerine","Pure Chem Oleo is a gold supplier from Selangor, Malaysia. They are a distributor specializing in detergent chemicals, industrial chemicals, glycerine and fatty acid. Founded in 2024. They list 1 product.",Adipic Acid,Adipic Acid,suppliers,2026-07-20
4097449,Far Edge Global Venture Sdn Bhd,https://www.go4worldbusiness.com/member/view/4097449/far-edge-global-venture-sdn-bhd.html,Malaysia,Shah Alam,"Lot 2B, Block 2, Level 2, Worldwide Business Park, Jalan Tinju 13/50, Seksyen 13 Shah Alam 40100 Selangor Malaysia",http://www.fegv.com.my,NULL,Nico Abel,Head Of Commercial,GOLD,"January, 2024",yes,Company Registration Certificate Verified,Far Edge Global Venture Sdn Bhd,2022,Dealer / Reseller,Buyer and Supplier,4,"Sells Organic chemical, inorganic chemical and wastewater treatment | Buys Organic chemical, inorganic chemical and wastewater treatment","Far Edge Global Venture Sdn Bhd is a gold buyer and supplier from Shah Alam, Malaysia. They are a dealer/reseller specializing in organic chemical, inorganic chemical, wastewater treatment and solvents. They are a dealer/reseller for organic chemical, inorganic chemical, wastewater treatment and solvents. Founded in 2022, they report annual sales of USD 250,000 to USD 1 million. They list 4 products.",Adipic Acid,Adipic Acid,suppliers,2026-07-20
2735850,Budi Oil Enterprise Sdn Bhd,https://www.go4worldbusiness.com/member/view/2735850/budi-oil-enterprise-sdn-bhd.html,Malaysia,Pelabuhan Klang,"Lot 11774, Jalan Ikan Mata Duyong Telok Gong Pelabuhan Klang 42000 Selangor Malaysia",https://www.go4worldbusiness.com/member/view/2735850/budi-oil-enterprise-sdn-bhd.html,NULL,Rithi,Business Development Manager,Premium,"November, 2019",NULL,NULL,Budi Oil Enterprise Sdn Bhd,1994,Dealer / Reseller,Supplier,11,"Sells Crude palm oil, palm acid oil and sludge oil","Budi Oil Enterprise Sdn Bhd is a junior supplier from Pelabuhan Klang, Malaysia. They are a dealer/reseller specializing in crude palm oil, palm acid oil, sludge oil and palm kernel acid oil. Founded in 1994, they report annual sales of USD 1 million to USD 5 million. They list 11 products.",Adipic Acid,Adipic Acid,suppliers,2026-07-20
211165,Kara Marketing (M) Sdn Bhd,https://www.go4worldbusiness.com/member/view/211165/kara-marketing-%28m%29-sdn-bhd.html,Malaysia,Puchong,"19, Jln Tpp 1 / 1 A, Tmn Industri Puchong, Batu 12, Jalan Puchong Puchong 47100 Selangor Malaysia",http://www.kara.com.my,NULL,Shereene,Export Executive,Premium,"January, 2005",NULL,NULL,Kara Marketing (M) Sdn Bhd,1999,Manufacturer/ OEM,Supplier,9,"Sells Coconut cream, coconut milk powder and coconut paste","Kara Marketing (M) Sdn Bhd is a junior supplier from Puchong, Malaysia. They are a manufacturer/oem specializing in coconut cream, coconut milk powder, coconut paste and desiccated coconut. Founded in 1999, they report annual sales of USD 15 million to USD 25 million. They list 9 products.",Adipic Acid; Agnus Castus Extract; Agnus Castus Extract Agnusides; Agnus Castus Powder; Agrimony Tops Extract; Hairy Agrimony Herb Powder; Alder Buckthorn Bark Extract; Alder Buckthorn Bark Powder; Alfalfa Extract; Alfalfa Juice Powder Gluten Free; Alfalfa Leaf Powder Gluten Free; Alfalfa Powder,Adipic Acid; Agnus Castus Extract & Products; Agrimony Extract & Products; Alder Buckthorn Extract & Products; Alfalfa Extract & Products,suppliers,2026-07-20
2782652,Accord Commodities Sdn Bhd,https://www.go4worldbusiness.com/member/view/2782652/accord-commodities-sdn-bhd.html,Malaysia,Kuala Lumpur,"Suite No.09-15, 9Th Floor Wisma Zelan No 1 Jalan Tasik Permasuri 2 Kuala Lumpur 56000 Wilayah Persekutuan Malaysia",http://www.accordmy.com,NULL,Fione Hong F.y,Manager,Premium,"January, 2020",NULL,NULL,Accord Commodities Sdn Bhd,16,Manufacturer/ OEM,Supplier,13,"Sells Soap noodles, oleochemical products and soap raw material","Accord Commodities Sdn Bhd is a junior supplier from Kuala Lumpur, Malaysia. They are a manufacturer/oem specializing in soap noodles, oleochemical products, soap raw material and palm kernel fatty acid distillate. Founded in 16, they report annual sales of USD 15 million to USD 25 million. They list 13 products.",Adipic Acid,Adipic Acid,suppliers,2026-07-20
1768669,Pasargo SDN BHD,https://www.go4worldbusiness.com/member/view/1768669/pasargo-sdn-bhd.html,Malaysia,Nilai,Nilai Nilai Malaysia,https://www.go4worldbusiness.com/member/view/1768669/pasargo-sdn-bhd.html,NULL,Zill,Director,Premium,"May, 2019",NULL,NULL,Pasargo SDN BHD,2017,Manufacturer/ OEM,Supplier,2,Sells Organic fertilizer and lemongrass,"Pasargo SDN BHD is a junior supplier from Nilai, Malaysia. They are a manufacturer/oem specializing in organic fertilizer and lemongrass. Founded in 2017. They are MYGAP and GLOBALGAP certified. They list 2 products.",Adipic Acid,Adipic Acid,suppliers,2026-07-20
1354616,Jutawan Muda Enterprise,https://www.go4worldbusiness.com/member/view/1354616/jutawan-muda-enterprise.html,Malaysia,Klang,"Bbt One The Towers,(South Tower) A-9-1, 9Th Floor , Lebuh Batu Nilam 1, Bandar Bukit Tinggi, Klang 41200 Selangor Malaysia",http://www.jutawan.com.my,NULL,Kanagarajah,Gm,Premium,"September, 2015",NULL,NULL,Jutawan Muda Enterprise,1995,Manufacturer/ OEM,Supplier,15,"Sells Refined palm oil, palm kernel oil & coconut oil and fats and fatty acid","Jutawan Muda Enterprise is a junior supplier from Klang, Malaysia. They are a manufacturer/oem specializing in refined palm oil, palm kernel oil & coconut oil and fats, fatty acid and residue oil. Founded in 1995, they report annual sales of USD 15 million to USD 25 million. They list 15 products.",Adipic Acid,Adipic Acid,suppliers,2026-07-20
1330025,Azure Vision Pte Ltd,https://www.go4worldbusiness.com/member/view/1330025/azure-vision-pte-ltd.html,Malaysia,Kuala Lumpur,"A4, 2-7, Solaris Dutamas Publika Jalan Dutamas 1 Kuala Lumpur 50480 Mont Kiara Malaysia",http://www.azurevision.com.my,+60 362 060 856,Kho,Regional Sales Manager,Premium,"June, 2015",NULL,NULL,Azure Vision Pte Ltd,2014,Dealer / Reseller,Supplier,NULL,NULL,"Azure Vision Pte Ltd is a junior supplier from Kuala Lumpur, Malaysia. They are a dealer/reseller specializing in natural rubber, latex, rubber chemicals (accelerators and antioxidants). Founded in 2014, they report annual sales of USD 15 million to USD 25 million. They are Rubber Trade License certified. They list 10 products.",Adipic Acid; Ajwain Seed Extract,Adipic Acid; Ajwain Extract & Products,suppliers,2026-07-20
1287751,Big Bob Mining & Trading (M) Sdn Bhd,https://www.go4worldbusiness.com/member/view/1287751/big-bob-mining-trading-%28m%29-sdn-bhd.html,Malaysia,Kuala Lumpur,"23-1, Premier Suite One Mont Kiara No.1 Jalan Kiara Mont Kiara Kuala Lumpur 50480 Federal Territory Malaysia",http://www.bigbobtrading.com,NULL,Gana Shekar,Director,Premium,"October, 2014",NULL,NULL,Big Bob Mining & Trading (M) Sdn Bhd,NULL,Dealer / Reseller,"Buyer, Supplier and Service Provider",5,"Sells Commodities such palm oil, palm olein and palm sterin | Buys Scraps of copper, iron and steel | Services Transportation and logistics","Big Bob Mining & Trading (M) Sdn Bhd is a junior buyer, supplier and service provider from Kuala Lumpur, Malaysia. They are a dealer/reseller specializing in commodities such palm oil, palm olein, palm sterin and crude palm oil. They are a dealer/reseller for scraps of copper, iron, steel and oil & gas. They provide services such as transportation and logistics. They report annual sales of around USD 250,000. They...",Adipic Acid; Ajwain Seed Extract,Adipic Acid; Ajwain Extract & Products,suppliers,2026-07-20
3231064,Saha Asia Industries (M) Sdn Bhd,https://www.go4worldbusiness.com/member/view/3231064/saha-asia-industries-%28m%29-sdn-bhd.html,Malaysia,shah Alam,"No.2, Jalan Enjin 34/3 Alpine Industrial Park, Seksyen 34, Alpine Industrial Park Shah Alam 40470 Selangor Malaysia",https://sahaasiaindustriesmsdnbhd.go4worldbusiness.online/,+60-127474923,Garnesh,Sales & Executive,Premium,"February, 2021",yes,Company Registration Certificate Verified,Saha Asia Industries (M) Sdn Bhd,2015,Manufacturer/ OEM,Supplier,14,NULL,"Saha Asia Industries (M) Sdn Bhd is a junior supplier from shah Alam, Malaysia. They are a manufacturer/oem specializing in rbd palm olein cp 6, cp8 and cp10.. Founded in 2015, they report annual sales of around USD 250,000. They are HALAL, MESTI, MPOB, MOH and COA certified. They list 14 products.",Adipic Acid; Agrimony Tops Extract,Adipic Acid; Agrimony Extract & Products,suppliers,2026-07-20
1503647,Go Fresh Distribution SDN BHD,https://www.go4worldbusiness.com/member/view/1503647/go-fresh-distribution-sdn-bhd.html,Malaysia,Skudai,33& 33a Jalan Bukit Impian 17 Taman Impian Emas Skudai 81300 Johor Malaysia,http://www.gofreshasia.com,NULL,Jeyaraman Rajendran,Manager,Premium,"August, 2017",NULL,NULL,Go Fresh Distribution SDN BHD,2014,NULL,Supplier,5,"Sells River sand, silica sand and precast concrete panel","Go Fresh Distribution SDN BHD is a junior supplier from Skudai, Malaysia. They supply river sand, silica sand and precast concrete panel. Founded in 2014, they report annual sales of around USD 250,000. They list 5 products.",Adipic Acid; Agnus Castus Extract; Agnus Castus Extract Agnusides; Alder Buckthorn Bark Extract; Alfalfa Extract,Adipic Acid; Agnus Castus Extract & Products; Alder Buckthorn Extract & Products; Alfalfa Extract & Products,suppliers,2026-07-20
2733478,Rada Synergy Sdn Bhd,https://www.go4worldbusiness.com/member/view/2733478/rada-synergy-sdn-bhd.html,Malaysia,Puchong Jaya,A-5-32 Ioi Boulevard Jalan Kenari 5 Puchong Jaya 47170 Selangor Malaysia,https://www.go4worldbusiness.com/member/view/2733478/rada-synergy-sdn-bhd.html,NULL,Syafiqah,Admin,Premium,"November, 2019",NULL,NULL,Rada Synergy Sdn Bhd,2015,Distributor,"Buyer, Supplier and Service Provider",NULL,Sells Phosphoric acid | Buys Phosphoric acid | Services Trading,"Rada Synergy Sdn Bhd is a junior buyer, supplier and service provider from Puchong Jaya, Malaysia. They are a distributor specializing in phosphoric acid. They are a distributor for phosphoric acid. They provide services such as trading. Founded in 2015.",Adipic Acid,Adipic Acid,companies,2026-07-20
3487751,Malaysian Phosphate Additives (sarawak) Sdn Bhd,https://www.go4worldbusiness.com/member/view/3487751/malaysian-phosphate-additives-%28sarawak%29-sdn-bhd.html,Malaysia,Bintulu,"No,482, S/lot 4206, Parkcity Commerce Square Phase 6, Jalan Tun Ahmad Zaidi Bintulu 97000 Sarawak Malaysia",https://www.go4worldbusiness.com/member/view/3487751/malaysian-phosphate-additives-%28sarawak%29-sdn-bhd.html,NULL,Amy Chaw,NULL,Premium,"December, 2021",NULL,NULL,Malaysian Phosphate Additives (sarawak) Sdn Bhd,2012,Manufacturer/ OEM,Buyer and Supplier,NULL,Sells Yellow phosphoric | Buys Rock phosphate lump and silica quartz,"Malaysian Phosphate Additives (sarawak) Sdn Bhd is a junior buyer and supplier from Bintulu, Malaysia. They are a manufacturer/oem specializing in yellow phosphoric. They are a manufacturer/oem for rock phosphate lump and silica quartz. Founded in 2012, they report annual sales of USD 250,000 to USD 1 million.",Adipic Acid,Adipic Acid,companies,2026-07-20
2795520,KSR Trading,https://www.go4worldbusiness.com/member/view/2795520/ksr-trading.html,Malaysia,Subang,- Subang 47610 Selangor Malaysia,https://www.go4worldbusiness.com/member/view/2795520/ksr-trading.html,NULL,Givita,Sales Manager,Premium,"February, 2020",NULL,NULL,KSR Trading,1985,Manufacturer/ OEM,Supplier,NULL,Sells Formic acid,"KSR Trading is a junior supplier from Subang, Malaysia. They are a manufacturer/oem specializing in formic acid. Founded in 1985.",Adipic Acid,Adipic Acid,companies,2026-07-20
683802,Kenso Corporation (M) Sdn Bhd,https://www.go4worldbusiness.com/member/view/683802/kenso-corporation-%28m%29-sdn-bhd.html,Malaysia,Petaling Jaya,"Suite 601, Menara Pj,amcorp Trade Centre Petaling Jaya 46050 Selangor Malaysia",http://www.kenso.zj.cn,NULL,Samantha Tan,Business Development Executive,Premium,"October, 2008",NULL,NULL,Kenso Corporation (M) Sdn Bhd,1974,Manufacturer/ OEM,Supplier,NULL,"Sells Sodium benzoate, benzoic acid and salicylic acid (pharmaceutical products)","Kenso Corporation (M) Sdn Bhd is a junior supplier from Petaling Jaya, Malaysia. They are a manufacturer/oem specializing in sodium benzoate, benzoic acid, salicylic acid (pharmaceutical products) and buprofezin 25% wp. Founded in 1974. They are ISO 9001:2000 certified.",Adipic Acid,Adipic Acid,companies,2026-07-20
4640122,Taiko Acid Works Sdn Bhd,https://www.go4worldbusiness.com/member/view/4640122/taiko-acid-works-sdn-bhd.html,Malaysia,Ipoh,"No 5, Jalan Sultan Nazrin Shah, Ipoh 30250 Perak Malaysia",http://www.taikogroup.net,NULL,Phoebe Loo,Marketing Manager,Premium,"February, 2026",NULL,NULL,Taiko Acid Works Sdn Bhd,1985,Manufacturer/ OEM,Supplier,NULL,Sells Sulphuric acid (sulphur burning acid),"Taiko Acid Works Sdn Bhd is a junior supplier from Ipoh, Malaysia. They are a manufacturer/oem specializing in sulphuric acid (sulphur burning acid). Founded in 1985. They are ISO9001:2015 certified.",Adipic Acid,Adipic Acid,companies,2026-07-20
4688326,Jack,https://www.go4worldbusiness.com/member/view/4688326/jack.html,Malaysia,NULL,Malaysia Malaysia 8400 Malaysia,https://www.go4worldbusiness.com/member/view/4688326/jack.html,NULL,Jack,Mr,Premium,"April, 2026",NULL,NULL,Jack,1970,Retailer,Supplier,NULL,Sells Sulphuric acid,"Jack is a junior supplier from Malaysia, Malaysia. They are a retailer specializing in sulphuric acid. Founded in 1970.",Adipic Acid,Adipic Acid,companies,2026-07-20
4519677,Premium Stores,https://www.go4worldbusiness.com/member/view/4519677/premium-stores.html,Malaysia,KL,Kuala Lumpur KL 47100 Selangor Malaysia,https://www.go4worldbusiness.com/member/view/4519677/premium-stores.html,NULL,Nelson,Manager,Premium,"August, 2025",NULL,NULL,Premium Stores,2013,Dealer / Reseller,Supplier,NULL,Sells Pome palm fatty acid distillate (pfad),"Premium Stores is a junior supplier from KL, Malaysia. They are a dealer/reseller specializing in pome palm fatty acid distillate (pfad). Founded in 2013.",Adipic Acid,Adipic Acid,companies,2026-07-20
3455056,Chemplasa Technology Sdn. Bhd.,https://www.go4worldbusiness.com/member/view/3455056/chemplasa-technology-sdn-bhd-.html,Malaysia,Pasir Gudang,"Plo 35, Jalan Nibong 2, Kawasan Perindustrian Tanjung Langsat, 81700 Pasir Gudang, Johor, Malaysia Pasir Gudang 81700 Johor Malaysia",https://chemplasa.com/,NULL,Chew Woan Lin,Sales Executive,Premium,"October, 2021",NULL,NULL,Chemplasa Technology Sdn. Bhd.,2017,Manufacturer/ OEM,Buyer and Supplier,1,NULL,"Chemplasa Technology Sdn. Bhd. is a junior buyer and supplier from Pasir Gudang, Malaysia. They are a manufacturer/oem specializing in stearic acid. They are a manufacturer/oem for plastic masterbatches and abs. Founded in 2017, they report annual sales of USD 1 million to USD 5 million. They are ISO9001 and ISO45001 certified. They list 1 product.",Adipic Acid,Adipic Acid,companies,2026-07-20
