company_id,company_name,company_profile_url,country,city,address,website,phone,contact_person,contact_designation,member_status,member_since,verified,verification_details,legal_entity,established_year,primary_business,role,products_listed_count,deal_focus,description,search_terms,category_types,search_tab,scrape_date
1220347,Yatai Chemical S/B,https://www.go4worldbusiness.com/member/view/1220347/yatai-chemical-s-b.html,Malaysia,Petaling Jaya,"Suite B -09-08 Tower B, Jalan Pju 1/39 Dataran Prima Petaling Jaya 47301 Selangor Malaysia",http://www.yataichemical.com,NULL,Kimmy Teo,Marketing Director,Premium,"January, 2014",NULL,NULL,Yatai Chemical S/B,NULL,Manufacturer/ OEM,Supplier,27,"Sells Mono ammonium phosphate, mono potassium phosphate and calcium nitrate","Yatai Chemical S/B is a junior supplier from Petaling Jaya, Malaysia. They are a manufacturer/oem specializing in mono ammonium phosphate, mono potassium phosphate, calcium nitrate and potassium nitrate. They list 27 products.",ATP Adenosine Triphosphate Disodium; Gum Acacia Soluble Fibre; Acai Berry Fruit Juice Powder; Acerola Cherry Fruit Juice Extract; Acesulfame-K; Adipic Acid; Agaricus Blazei Mushroom Fungus Fruiting Body Powder; Agarikon Mushroom Fungus Fruiting Body Powder Polysaccharides,ATP; Acacia Fiber; Acai Berry Extract & Products; Acerola Cherry Extract & Products; Acesulfame; Adipic Acid; Agaricus Extract & Products; Agarikon Extract & Products,suppliers,2026-07-20
944980,Enagic Inc.,https://www.go4worldbusiness.com/member/view/944980/enagic-inc-.html,Malaysia,Sydney,Sydney Sydney 2113 Malaysia,http://jordanstreet.kangendemo.com,NULL,Jordan Street,Director,Premium,"October, 2010",NULL,NULL,Enagic Inc.,2008,Distributor,Supplier,3,NULL,"Enagic Inc. is a junior supplier from Sydney, Malaysia. They are a distributor specializing in ionized water ionizer. Founded in 2008, they report annual sales of USD 5 million to USD 15 million. They list 3 products.",ATP Adenosine Triphosphate Disodium,ATP,suppliers,2026-07-20
1527582,Golden Print Head,https://www.go4worldbusiness.com/member/view/1527582/golden-print-head.html,Malaysia,NULL,No.37 Jalan Utama Sr1/7 Serdang Raya Malaysia 43300 Selangor Malaysia,http://www.goldenprinthead.com,NULL,Edward Chow,NULL,GOLD,"November, 2017",NULL,NULL,Golden Print Head,2012,Manufacturer/ OEM,Buyer and Supplier,8,Sells Printer | Buys Printer,"Golden Print Head is a junior buyer and supplier from Malaysia, Malaysia. They are a manufacturer/oem specializing in printers. They are a manufacturer/oem for printer. Founded in 2012. They list 8 products.",ATP Adenosine Triphosphate Disodium,ATP,suppliers,2026-07-20
3517782,Lee Chuan Guan Steel Sdn Bhd,https://www.go4worldbusiness.com/member/view/3517782/lee-chuan-guan-steel-sdn-bhd.html,Malaysia,Johor Bahru,"Plo 132 Jalan Angkasa Mas Utama, Kawasan Perindustrian Tebrau 2 Johor Bahru 81100 Johor Malaysia",http://www.lcgjapmas.com,NULL,Asyiqin,Sales Engineer,Premium,"January, 2022",yes,Company Registration Certificate Verified,Lee Chuan Guan Steel Sdn Bhd,1982,Manufacturer/ OEM,Supplier,7,NULL,"Lee Chuan Guan Steel Sdn Bhd is a junior supplier from Johor Bahru, Malaysia. They are a manufacturer/oem specializing in steel products, steel sheets, steel coils and steel plates. Founded in 1982, they report annual sales of more than USD 100 million. They are ISO9001 certified. They list 7 products.",Gum Acacia Soluble Fibre; Acerola Cherry Fruit Fibre,Acacia Fiber; Acerola Cherry Extract & Products,suppliers,2026-07-20
4473223,RBC Trading,https://www.go4worldbusiness.com/member/view/4473223/rbc-trading.html,Malaysia,Kota Bharu,"Kampung Sirih, 15150 Kota Bharu, Kelantan, Malaysia. Kota Bharu 15150 Kelantan Malaysia",http://rbctradings.com,NULL,Ramona Binti Nizam,Director,GOLD,"July, 2025",yes,Company Registration Certificate Verified,RBC Trading,2021,Service Provider,Supplier and Service Provider,7,NULL,"RBC Trading is a gold supplier and service provider from Kota Bharu, Malaysia. They are a service provider specializing in petroleum coke, copper concentrate, zinc concentrate and liquefied natural gas. They provide services such as trading. Founded in 2021, they report annual sales of USD 250,000 to USD 1 million. They are RBC Trading certified. They list 7 products.",Gum Acacia Soluble Fibre; Acai Berry Fruit Extract; Acai Berry Fruit Powder; Acerola Cherry Fruit Fibre; Acesulfame-K; Ajwain Seed Extract,Acacia Fiber; Acai Berry Extract & Products; Acerola Cherry Extract & Products; Acesulfame; Ajwain Extract & Products,suppliers,2026-07-20
2736738,Sterimed Sdn Bhd,https://www.go4worldbusiness.com/member/view/2736738/sterimed-sdn-bhd.html,Malaysia,Kuala Lumpur,"24 Jalan Mutiara 1, Taman Mutiara Barat Kuala Lumpur 56000 W. Persekutuan Malaysia",http://www.sterimed.com.my,NULL,Thomas Cheong,Director,GOLD,"November, 2019",NULL,NULL,Sterimed Sdn Bhd,2002,Dealer / Reseller,NULL,NULL,NULL,"Sterimed Sdn Bhd is a gold buyer and supplier from Kuala Lumpur, Malaysia. They are a dealer/reseller specializing in latex based products: latex examination gloves, surgical gloves, household gloves and pvc and leather gloves. They are a dealer/reseller for dried sea cucumbers, fish maws, seaweed and sulphur granules. Founded in 2002, they report annual sales of USD 5 million to USD 15 million. They are 568957P...",Gum Acacia Soluble Fibre; Acai Berry Fruit Extract; Acai Berry Fruit Powder; Adipic Acid; Agnus Castus Extract; Agnus Castus Extract Agnusides; Agnus Castus Powder; Agrimony Tops Extract; Hairy Agrimony Herb Powder; Ajwain Seed Extract; Akarkara Root Powder; Alder Buckthorn Bark Extract; Alder Buckthorn Bark Powder; Alfalfa Extract; Alfalfa Juice Powder Gluten Free; Alfalfa Leaf Powder Gluten Free; Alfalfa Powder,Acacia Fiber; Acai Berry Extract & Products; Adipic Acid; Agnus Castus Extract & Products; Agrimony Extract & Products; Ajwain Extract & Products; Akarkara Extract & Products; Alder Buckthorn Extract & Products; Alfalfa Extract & Products,suppliers,2026-07-20
3083856,Axtrium Sdn Bhd,https://www.go4worldbusiness.com/member/view/3083856/axtrium-sdn-bhd.html,Malaysia,Kuala Lumpur,"B-06-06, Gateway Kiaramas (Corporate Suites),1, Jalan Desa Kiara Kuala Lumpur 50480 Mont Kiara Malaysia",https://www.go4worldbusiness.com/member/view/3083856/axtrium-sdn-bhd.html,NULL,Douglass Phang,Managing Director,Premium,"October, 2020",NULL,NULL,Axtrium Sdn Bhd,2015,Distributor,Buyer and Supplier,37,NULL,"Axtrium Sdn Bhd is a junior buyer and supplier from Kuala Lumpur, Malaysia. They are a distributor specializing in fish & seafood, palm oil based products, red palm olein and refined palm oil. They are a distributor for palm oil, sugar, chicken and meat. Founded in 2015, they report annual sales of USD 1 million to USD 5 million. They are Axtrium Sdn Bhd certified. They list 37 products.",Gum Acacia Soluble Fibre; Acerola Cherry Fruit Fibre; Adipic Acid; Agnus Castus Extract; Agnus Castus Extract Agnusides; Agrimony Tops Extract; Ajwain Seed Extract; Alder Buckthorn Bark Extract; Alfalfa Extract,Acacia Fiber; Acerola Cherry Extract & Products; Adipic Acid; Agnus Castus Extract & Products; Agrimony Extract & Products; Ajwain Extract & Products; Alder Buckthorn Extract & Products; Alfalfa Extract & Products,suppliers,2026-07-20
3038129,D-jah Corporation Sdn Bhd,https://www.go4worldbusiness.com/member/view/3038129/d-jah-corporation-sdn-bhd.html,Malaysia,Johor bahru,"No 20 A, Jalan Uda Utama 4/1, Bandar Uda Utama Johor Bahru 81200 Johor Malaysia",http://www.djahcorp.com,NULL,Datuk Haji Mohd Najib Alwi,Managing Director,Premium,"August, 2020",yes,Company Registration Certificate Verified,D-jah Corporation Sdn Bhd,2000,Dealer / Reseller,Supplier,6,Sells 1. nitrile examination powder free gloves from manufacturer in malaysia. 2. latex examination powder free gloves and 3. isolation gown with fda 4. hand sanitizer and disinfectant spray,"D-jah Corporation Sdn Bhd is a junior supplier from Johor bahru, Malaysia. They are a dealer/reseller specializing in 1. nitrile examination powder free gloves from manufacturer in malaysia. 2. latex examination powder free gloves and 3. isolation gown with fda 4. hand sanitizer and disinfectant spray. Founded in 2000, they report annual sales of USD 1 million to USD 5 million. They list 6 products.",Gum Acacia Soluble Fibre; Acerola Cherry Fruit Fibre; Alfalfa Juice Powder Gluten Free; Alfalfa Leaf Powder Gluten Free,Acacia Fiber; Acerola Cherry Extract & Products; Alfalfa Extract & Products,suppliers,2026-07-20
1492917,Golden Gates Global SDN BHD,https://www.go4worldbusiness.com/member/view/1492917/golden-gates-global-sdn-bhd.html,Malaysia,Pj,Tropicana Avenue PJ 474800 Selangor Malaysia,https://www.go4worldbusiness.com/member/view/1492917/golden-gates-global-sdn-bhd.html,NULL,Ahmed,Marketing Director,GOLD,"July, 2017",NULL,NULL,Golden Gates Global SDN BHD,2013,Distributor,Supplier,1,Sells Coconut oil,"Golden Gates Global SDN BHD is a junior supplier from Pj, Malaysia. They are a distributor specializing in coconut oil. Founded in 2013. They list 1 product.",Gum Acacia Soluble Fibre,Acacia Fiber,suppliers,2026-07-20
915504,Fidelio International Sdn Bhd,https://www.go4worldbusiness.com/member/view/915504/fidelio-international-sdn-bhd.html,Malaysia,Kuala Lumpur,"Unit 8.06, Level 8, Menara Pj Amcorp Trade Centre No 18 Persiaran Barat Petaling Jaya Kuala Lumpur 46050 Selangor Malaysia",http://www.fideliointernational.com,NULL,Ms Vettina,Senior Business Development,Premium,"July, 2010",NULL,NULL,Fidelio International Sdn Bhd,1996,Manufacturer/ OEM,Buyer and Supplier,16,"Sells Nitrile gloves, hygiene range of dispenser & soap dispenser and hygiene products such as brooms | Buys Nitrile gloves, hygiene range of dispenser & soap dispenser and hygiene products such as brooms","Fidelio International Sdn Bhd is a junior buyer and supplier from Kuala Lumpur, Malaysia. They are a manufacturer/oem specializing in nitrile gloves, hygiene range of dispenser & soap dispenser, hygiene products such as brooms and softies. They are a manufacturer/oem for nitrile gloves, hygiene range of dispenser & soap dispenser, hygiene products such as brooms and softies. Founded in 1996. They list 16 products.",Gum Acacia Soluble Fibre; Acerola Cherry Fruit Fibre; Agnus Castus Extract; Agnus Castus Extract Agnusides; Agrimony Tops Extract; Alder Buckthorn Bark Extract; Alfalfa Extract,Acacia Fiber; Acerola Cherry Extract & Products; Agnus Castus Extract & Products; Agrimony Extract & Products; Alder Buckthorn Extract & Products; Alfalfa Extract & Products,suppliers,2026-07-20
1348346,RK Capital Sdn Bhd,https://www.go4worldbusiness.com/member/view/1348346/rk-capital-sdn-bhd.html,Malaysia,Mont Kiara,NULL,https://www.go4worldbusiness.com/member/view/1348346/rk-capital-sdn-bhd.html,NULL,NULL,NULL,NULL,NULL,NULL,NULL,NULL,NULL,NULL,NULL,NULL,NULL,NULL,Gum Acacia Soluble Fibre,Acacia Fiber,suppliers,2026-07-20
3196890,Elaf Services Group,https://www.go4worldbusiness.com/member/view/3196890/elaf-services-group.html,Malaysia,Kuala Lumpur,"F-2-2 Pusat Komersial Starparc Point, Setapack, - 53300 Kuala Lumpur Malaysia",http://www.elafservices.com.my,NULL,Mohamad Darwish,Salesperson,Premium,"January, 2021",NULL,NULL,Elaf Services Group,2019,Dealer / Reseller,Supplier,13,"Sells Rails steel (used and new), metals ores (nickel and copper)","Elaf Services Group is a junior supplier from Malaysia. They are a dealer/reseller specializing in rails steel (used and new), metals ores (nickel, copper) and wood and charcoal. Founded in 2019, they report annual sales of USD 250,000 to USD 1 million. They list 13 products.",Gum Acacia Soluble Fibre; Agnus Castus Powder; Hairy Agrimony Herb Powder; Akarkara Root Powder; Alder Buckthorn Bark Powder; Alfalfa Juice Powder Gluten Free; Alfalfa Leaf Powder Gluten Free; Alfalfa Powder,Acacia Fiber; Agnus Castus Extract & Products; Agrimony Extract & Products; Akarkara Extract & Products; Alder Buckthorn Extract & Products; Alfalfa Extract & Products,suppliers,2026-07-20
4733153,Tropic Sun Trading,https://www.go4worldbusiness.com/member/view/4733153/tropic-sun-trading.html,Malaysia,Spg. Ampat,"72 Hijauan Hill, Spg. Ampat 14120 Penang Malaysia",https://www.tropicsun.biz/tamagin-power/,NULL,Liroy,Business Executive,Premium,"July, 2026",NULL,NULL,Tropic Sun Trading,2018,Manufacturer/ OEM,NULL,NULL,NULL,"Tropic Sun Trading is a junior supplier from Spg. Ampat, Malaysia. They are a manufacturer/oem specializing in power/functional beverages and tamagin coffee latte.. Founded in 2018, they report annual sales of USD 1 million to USD 5 million. They list 2 products.",Gum Acacia Soluble Fibre,Acacia Fiber,suppliers,2026-07-20
1634970,Tlc Agritrade,https://www.go4worldbusiness.com/member/view/1634970/tlc-agritrade.html,Malaysia,Kuala Lumpur,NULL,http://www.tlcagritrade.com,NULL,NULL,NULL,NULL,NULL,NULL,NULL,NULL,NULL,NULL,NULL,NULL,NULL,"About the Supplier and Service Provider TLC Agritrade Sdn. Bhd. is spawned through collaborations with manufacturing companies located in Indonesia, with a focus on agricultural products. This company acts as a specialised marketing arm to connect companies to trade agricultural products on a global scale. Currently, TLC Agritrade's emphasis is geared toward coconut products, specifically High Fat Desiccated Coconut, Virgin Coconut Oil, and Shell Charcoal. The company synergistic alliance with several Indonesian manufacturers will bring forth a strong base for exports to international clients. Supplier Fresh matured coconut, coconut fibre, coconut shell charcoal, copra, coconut oil like vco, crude, rbd, desiccated coconut, coconut cream, coconut milk, coconut powder, coconut water Services Broker",Gum Acacia Soluble Fibre; Acerola Cherry Fruit Fibre,Acacia Fiber; Acerola Cherry Extract & Products,suppliers,2026-07-20
3259667,Amlion Personal Care Manufacturing Sdn Bhd,https://www.go4worldbusiness.com/member/view/3259667/amlion-personal-care-manufacturing-sdn-bhd.html,Malaysia,Petaling Jaya,"Lot 4 Gate A Jalan Teknologi 3/6, Seksyen 3 Taman Sains Selangor, Kota Damansara Petaling Jaya 47810 Selangor Malaysia",http://www.amlion.com.my,NULL,Beatrice Lai Phone: Not displayed by user.,NULL,Premium,"March, 2021",yes,VERIFIED Fetching... Verification Status Company Registration Certificate Identity Proof Of Representative Company Address Proof Trading License − Proof of Prior Export/Import − Proof of Product − Company Representative Verified on Video Call − Other Documents like Mandates and Certifications −,Amlion Personal Care Manufacturing Sdn Bhd,1994,Manufacturer/ OEM,Supplier,6,"Sells Toothpaste, mouthwash and body wash","Amlion Personal Care Manufacturing Sdn Bhd is a verified junior supplier from Petaling Jaya, Malaysia. They are a manufacturer/oem specializing in toothpaste, mouthwash, body wash and shampoo. Founded in 1994. They list 6 products.",Gum Acacia Soluble Fibre; Agaricus Blazei Mushroom Fungus Fruiting Body Powder; Agarikon Mushroom Fungus Fruiting Body Powder Polysaccharides,Acacia Fiber; Agaricus Extract & Products; Agarikon Extract & Products,suppliers,2026-07-20
1758834,Erapoly Global Sdn Bhd,https://www.go4worldbusiness.com/member/view/1758834/erapoly-global-sdn-bhd.html,Malaysia,Semenyih,"Lot 4089, Jalan P4 /8 Bandar Teknologi Kajang Semenyih 43500 Selangor Malaysia",http://www.erapolyglobal.com,NULL,Kt Chin,Managing Director,Premium,"May, 2019",NULL,NULL,Erapoly Global Sdn Bhd,2008,Manufacturer/ OEM,Supplier and Service Provider,7,NULL,"Erapoly Global Sdn Bhd is a junior supplier and service provider from Semenyih, Malaysia. They are a manufacturer/oem specializing in vegan coconut cream powder, coconut milk powder, uht coconut milk and uht coconut water. They provide services such as private label. Founded in 2008, they report annual sales of USD 25 million to USD 50 million. They are FSSC 22000 certified. They list 7 products.",Gum Acacia Soluble Fibre; Agnus Castus Extract; Agnus Castus Extract Agnusides; Agrimony Tops Extract; Alder Buckthorn Bark Extract; Alfalfa Extract; Alfalfa Juice Powder Gluten Free; Alfalfa Leaf Powder Gluten Free,Acacia Fiber; Agnus Castus Extract & Products; Agrimony Extract & Products; Alder Buckthorn Extract & Products; Alfalfa Extract & Products,suppliers,2026-07-20
2902202,Mascellent Resources Sdn Bhd,https://www.go4worldbusiness.com/member/view/2902202/mascellent-resources-sdn-bhd.html,Malaysia,Subang Jaya,"11a, Jalan Industri Usj 1/3, Taman Perindustrian Usj 1 Subang Jaya 47600 Selangor Malaysia",http://www.mascellent.com,NULL,Victor,Export Manager,Premium,"May, 2020",NULL,NULL,Mascellent Resources Sdn Bhd,2005,Manufacturer/ OEM,Supplier,8,NULL,"Mascellent Resources Sdn Bhd is a junior supplier from Subang Jaya, Malaysia. They are a manufacturer/oem specializing in coffee products. e.g green bean, roasted coffee beans (arabica or robusta), instant coffee powder: freeze-dried and spray dried. premix 3 in 1 coffee. Founded in 2005, they report annual sales of USD 15 million to USD 25 million. They are GMP, HALAL and HEALTH CERT certified. They list 8 products.",Gum Acacia Soluble Fibre; Acai Berry Fruit Extract; Acai Berry Fruit Juice Powder; Acai Berry Fruit Powder; Agnus Castus Powder; Hairy Agrimony Herb Powder; Akarkara Root Powder; Alder Buckthorn Bark Powder; Alfalfa Powder,Acacia Fiber; Acai Berry Extract & Products; Agnus Castus Extract & Products; Agrimony Extract & Products; Akarkara Extract & Products; Alder Buckthorn Extract & Products; Alfalfa Extract & Products,suppliers,2026-07-20
2884306,Vici Marketing Sdn. Bhd.,https://www.go4worldbusiness.com/member/view/2884306/vici-marketing-sdn-bhd-.html,Malaysia,Kuala Lumpur,"No. 203, Jalan Bukit Bintang Kuala Lumpur 55100 Wilayah Persekutuan Malaysia",https://www.go4worldbusiness.com/member/view/2884306/vici-marketing-sdn-bhd-.html,NULL,Chew Hiew Kuang,Director,Premium,"April, 2020",yes,NULL,Vici Marketing Sdn. Bhd.,2019,Dealer / Reseller,Supplier,10,"Sells N95, 3 ply face mask civil and medical and kn95 ffp2 face mask","Vici Marketing Sdn. Bhd. is a junior supplier from Kuala Lumpur, Malaysia. They are a dealer/reseller specializing in n95, 3 ply face mask civil and medical, kn95 ffp2 face mask and frozen chicken meat and parts. Founded in 2019. They list 10 products.",Gum Acacia Soluble Fibre; Acerola Cherry Fruit Fibre; Agnus Castus Extract; Agnus Castus Extract Agnusides; Agrimony Tops Extract; Ajwain Seed Extract; Alder Buckthorn Bark Extract; Alfalfa Extract; Alfalfa Juice Powder Gluten Free; Alfalfa Leaf Powder Gluten Free,Acacia Fiber; Acerola Cherry Extract & Products; Agnus Castus Extract & Products; Agrimony Extract & Products; Ajwain Extract & Products; Alder Buckthorn Extract & Products; Alfalfa Extract & Products,suppliers,2026-07-20
303187,Robiah Enterprise Sdn Bhd,https://www.go4worldbusiness.com/member/view/303187/robiah-enterprise-sdn-bhd.html,Malaysia,Taman Tun Dr.Ismail,"57, Jalan Athinahappan Ttdi Taman Tun Dr.ismail 60000 Kuala Lumpur Malaysia",https://www.go4worldbusiness.com/member/view/303187/robiah-enterprise-sdn-bhd.html,NULL,Robiah Ahmad,Managing Director,Premium,"September, 2005",NULL,NULL,Robiah Enterprise Sdn Bhd,2005,Manufacturer/ OEM,"Buyer, Supplier and Service Provider",3,NULL,"Robiah Enterprise Sdn Bhd is a junior buyer, supplier and service provider from Taman Tun Dr.Ismail, Malaysia. They are a manufacturer/oem specializing in tapioca chips, (snacks), tapioca starch and raw dried. They are a manufacturer/oem for tapioca chips, (snacks), tapioca starch and raw dried. They provide services such as advertising. Founded in 2005, they report annual sales of USD 250,000 to USD 1 million. They...",Gum Acacia Soluble Fibre; Acerola Cherry Fruit Fibre,Acacia Fiber; Acerola Cherry Extract & Products,suppliers,2026-07-20
3935764,VRK Global Traders Sdn. Bhd.,https://www.go4worldbusiness.com/member/view/3935764/vrk-global-traders-sdn-bhd-.html,Malaysia,Johor Bahru,"No. 75-2, Jalan Bina 1, Bandar Seri Alam Johor Bahru 81750 Johor Malaysia",http://www.vrkglobaltraders.io,NULL,Dr. Vijayajothi Paramasivam,Chief Executive Officer (Ceo),Premium,"June, 2023",yes,VERIFIED Fetching... Verification Status Company Registration Certificate Identity Proof Of Representative − Company Address Proof − Trading License − Proof of Prior Export/Import − Proof of Product − Company Representative Verified on Video Call − Other Documents like Mandates and Certifications −,VRK Global Traders Sdn. Bhd.,2021,Dealer / Reseller,Supplier and Service Provider,8,"Sells 1) hindu prayer products ie. incense sticks, ghee diyas and cup sambrani | Services Manufacturer","VRK Global Traders Sdn. Bhd. is a verified junior supplier and service provider from Johor Bahru, Malaysia. They are a dealer/reseller specializing in 1) hindu prayer products ie. incense sticks, ghee diyas, cup sambrani and vibuthi. They provide services such as manufacturer. Founded in 2021, they report annual sales of around USD 250,000. They list 8 products.",Gum Acacia Soluble Fibre,Acacia Fiber,suppliers,2026-07-20
1461735,Green Touch Trading Sdn Bhd,https://www.go4worldbusiness.com/member/view/1461735/green-touch-trading-sdn-bhd.html,Malaysia,Kuala Lumpur,"No. 25-2, Plaza Danau 2, Jalan 5/109F Taman Danau Desa Kuala Lumpur 58100 Malaysia",http://www.qmconsultants.com.my,NULL,Engr N. Paramadevan,Managing Director,Premium,"February, 2017",NULL,NULL,Green Touch Trading Sdn Bhd,2015,Dealer / Reseller,Supplier and Service Provider,7,"Sells Vegetable oil, crude palm oil [from first extraction] and rbd palm oil [for shortenings | Services Labeling, packaging and transportation - FOB","Green Touch Trading Sdn Bhd is a junior supplier and service provider from Kuala Lumpur, Malaysia. They are a dealer/reseller specializing in vegetable oil, crude palm oil [from first extraction], rbd palm oil [for shortenings and frying fats. They provide services such as labeling, packaging, transportation - fob and cfr/cnf/c&f. Founded in 2015. They are MS ISO 9001:2015 QMS certified. They list 7 products.",Gum Acacia Soluble Fibre; Acai Berry Fruit Extract; Acerola Cherry Fruit Juice Extract; Agnus Castus Extract; Agnus Castus Extract Agnusides; Agrimony Tops Extract; Ajwain Seed Extract; Alder Buckthorn Bark Extract; Alfalfa Extract,Acacia Fiber; Acai Berry Extract & Products; Acerola Cherry Extract & Products; Agnus Castus Extract & Products; Agrimony Extract & Products; Ajwain Extract & Products; Alder Buckthorn Extract & Products; Alfalfa Extract & Products,suppliers,2026-07-20
3191890,Mkn Enterprise,https://www.go4worldbusiness.com/member/view/3191890/mkn-enterprise.html,Malaysia,Butterworth,"Sungai Lokan, Sungai Dua Butterworth 12000 Pulau Pinang Malaysia",https://www.go4worldbusiness.com/member/view/3191890/mkn-enterprise.html,NULL,Raj,Manager,Premium,"January, 2021",NULL,NULL,Mkn Enterprise,2000,Dealer / Reseller,"Buyer, Supplier and Service Provider",1,"Sells Coconut coir, coconut fiber and cocopeat | Buys Coconut coir, coconut fiber and cocopeat | Services Mining and tradings","Mkn Enterprise is a junior buyer, supplier and service provider from Butterworth, Malaysia. They are a dealer/reseller specializing in coconut coir, coconut fiber, cocopeat and sand mining. They are a dealer/reseller for coconut coir, coconut fiber, cocopeat and sand mining. They provide services such as mining and tradings. Founded in 2000. They list 1 product.",Gum Acacia Soluble Fibre,Acacia Fiber,suppliers,2026-07-20
1741971,Shop Freakers Ltd,https://www.go4worldbusiness.com/member/view/1741971/shop-freakers-ltd.html,Malaysia,Petaling Jaya,Contact Me Through Whatapp Petaling Jaya 46000 Kuala Lumpur Malaysia,https://www.go4worldbusiness.com/member/view/1741971/shop-freakers-ltd.html,NULL,Okoh Chiedu,Phone: Not displayed by user.,Premium,"April, 2019",NULL,NULL,Shop Freakers Ltd,2002,Manufacturer/ OEM,Supplier,1,Sells Optimum quality abaca fiber and blessed with a country full of natural resources our abaca fiber,"Shop Freakers Ltd is a junior supplier from Petaling Jaya, Malaysia. They are a manufacturer/oem specializing in optimum quality abaca fiber and blessed with a country full of natural resources our abaca fiber. Founded in 2002. They list 1 product.",Gum Acacia Soluble Fibre,Acacia Fiber,suppliers,2026-07-20
1469144,Dante Deo Traders,https://www.go4worldbusiness.com/member/view/1469144/dante-deo-traders.html,Malaysia,Sunway,"Suite 20-01 & 20-02B Level 20, The Pinnacle Sunway 46150 Selangor Malaysia",http://www.dantedeotrader.com,NULL,Adriana,Ceo,Premium,"April, 2017",NULL,NULL,Dante Deo Traders,2015,Service Provider,Supplier and Service Provider,3,"Sells Frozen whole halal chicken, okra and garlic | Services Trade","Dante Deo Traders is a junior supplier and service provider from Sunway, Malaysia. They are a service provider specializing in frozen whole halal chicken, okra, garlic and sugar icumsa 45. They provide services such as trade. Founded in 2015. They list 3 products.",Gum Acacia Soluble Fibre; Agnus Castus Extract; Agnus Castus Extract Agnusides; Agrimony Tops Extract; Alder Buckthorn Bark Extract; Alfalfa Extract,Acacia Fiber; Agnus Castus Extract & Products; Agrimony Extract & Products; Alder Buckthorn Extract & Products; Alfalfa Extract & Products,suppliers,2026-07-20
