company_id,company_name,company_profile_url,country,city,address,website,phone,contact_person,contact_designation,member_status,member_since,verified,verification_details,legal_entity,established_year,primary_business,role,products_listed_count,deal_focus,description,search_terms,category_types,search_tab,scrape_date
2741271,Sri Weeras Marketing Sdn Bhd,https://www.go4worldbusiness.com/member/view/2741271/sri-weeras-marketing-sdn-bhd.html,Malaysia,Klang,No.85 Lorong Sanggul 1 F Bandar Puteri Klang Selangor Dahrul Ehsan Klang 41200 Selangor Malaysia,https://www.go4worldbusiness.com/member/view/2741271/sri-weeras-marketing-sdn-bhd.html,NULL,Bela Jong Horvath Phone: Not displayed by user.,NULL,Premium,"December, 2019",NULL,NULL,Sri Weeras Marketing Sdn Bhd,2018,Dealer / Reseller,Supplier and Service Provider,NULL,Sells Cocoa powder | Services CIF and export,"Sri Weeras Marketing Sdn Bhd is a junior supplier and service provider from Klang, Malaysia. They are a dealer/reseller specializing in cocoa powder. They provide services such as cif and export. Founded in 2018.",Agnus Castus Powder; Akarkara Root Powder; Alder Buckthorn Bark Powder; Alfalfa Powder,Agnus Castus Extract & Products; Akarkara Extract & Products; Alder Buckthorn Extract & Products; Alfalfa Extract & Products,companies,2026-07-20
1347700,Mackt Commerce Sdn. Bhd.,https://www.go4worldbusiness.com/member/view/1347700/mackt-commerce-sdn-bhd-.html,Malaysia,Petaling Jaya,"Ground Floor, Bangunan Th, No.5, Jalan B Petaling Jaya 46200 Selangor Malaysia",http://www.macktcommerce.com.my,NULL,Mohamed Fazal Noor Phone: Not displayed by user.,NULL,Premium,"August, 2015",NULL,NULL,Mackt Commerce Sdn. Bhd.,2009,Manufacturer/ OEM,Supplier,NULL,Sells Alkalized and natural cocoa powder,"Mackt Commerce Sdn. Bhd. is a junior supplier from Petaling Jaya, Malaysia. They are a manufacturer/oem specializing in alkalized and natural cocoa powder. Founded in 2009, they report annual sales of USD 15 million to USD 25 million.",Agnus Castus Powder; Akarkara Root Powder; Alder Buckthorn Bark Powder; Alfalfa Powder,Agnus Castus Extract & Products; Akarkara Extract & Products; Alder Buckthorn Extract & Products; Alfalfa Extract & Products,companies,2026-07-20
4023240,Easteknik Resources,https://www.go4worldbusiness.com/member/view/4023240/easteknik-resources.html,Malaysia,NULL,- - Malaysia,https://www.go4worldbusiness.com/member/view/4023240/easteknik-resources.html,NULL,Firdausrazak95 Phone: Not displayed by user.,NULL,Premium,"October, 2023",NULL,NULL,Easteknik Resources,2023,NULL,Supplier,NULL,Sells Coffee Powder,Easteknik Resources is a junior supplier from Malaysia. They supply coffee powder. Founded in 2023.,Agnus Castus Powder; Alder Buckthorn Bark Powder; Alfalfa Powder,Agnus Castus Extract & Products; Alder Buckthorn Extract & Products; Alfalfa Extract & Products,companies,2026-07-20
3207589,Moo Cow International Sdn Bhd,https://www.go4worldbusiness.com/member/view/3207589/moo-cow-international-sdn-bhd.html,Malaysia,Kuala Lumpur,NULL,NULL,NULL,NULL,NULL,NULL,NULL,NULL,NULL,NULL,NULL,NULL,NULL,NULL,NULL,NULL,Agnus Castus Powder; Alder Buckthorn Bark Powder; Alfalfa Powder,Agnus Castus Extract & Products; Alder Buckthorn Extract & Products; Alfalfa Extract & Products,companies,2026-07-20
4408005,Era Dinamika SDN BHD,https://www.go4worldbusiness.com/member/view/4408005/era-dinamika-sdn-bhd.html,Malaysia,Klang,NULL,NULL,NULL,NULL,NULL,NULL,NULL,NULL,NULL,NULL,NULL,NULL,NULL,NULL,NULL,NULL,Agnus Castus Powder; Alder Buckthorn Bark Powder; Alfalfa Powder,Agnus Castus Extract & Products; Alder Buckthorn Extract & Products; Alfalfa Extract & Products,companies,2026-07-20
4617613,Rylex Logistics,https://www.go4worldbusiness.com/member/view/4617613/rylex-logistics.html,Malaysia,NULL,NULL,NULL,NULL,NULL,NULL,NULL,NULL,NULL,NULL,NULL,NULL,NULL,NULL,NULL,NULL,NULL,Agnus Castus Powder; Alder Buckthorn Bark Powder; Alfalfa Powder,Agnus Castus Extract & Products; Alder Buckthorn Extract & Products; Alfalfa Extract & Products,companies,2026-07-20
1485838,Sh Jati Trading Sdn Bhd,https://www.go4worldbusiness.com/member/view/1485838/sh-jati-trading-sdn-bhd.html,Malaysia,Kuala Lumpur,NULL,NULL,NULL,NULL,NULL,NULL,NULL,NULL,NULL,NULL,NULL,NULL,NULL,NULL,NULL,NULL,Agnus Castus Powder; Alder Buckthorn Bark Powder; Alfalfa Powder,Agnus Castus Extract & Products; Alder Buckthorn Extract & Products; Alfalfa Extract & Products,companies,2026-07-20
1556527,Goa Taste M SDN BHD,https://www.go4worldbusiness.com/member/view/1556527/goa-taste-m-sdn-bhd.html,Malaysia,Masai,NULL,NULL,NULL,NULL,NULL,NULL,NULL,NULL,NULL,NULL,NULL,NULL,NULL,NULL,NULL,NULL,Agnus Castus Powder; Alder Buckthorn Bark Powder; Alfalfa Powder,Agnus Castus Extract & Products; Alder Buckthorn Extract & Products; Alfalfa Extract & Products,companies,2026-07-20
1133906,Sv Omni Marketing Sdn Bhd,https://www.go4worldbusiness.com/member/view/1133906/sv-omni-marketing-sdn-bhd.html,Malaysia,Shah Alam,NULL,NULL,NULL,NULL,NULL,NULL,NULL,NULL,NULL,NULL,NULL,NULL,NULL,NULL,NULL,NULL,Agnus Castus Powder,Agnus Castus Extract & Products,companies,2026-07-20
2992204,Mamr Enterprise,https://www.go4worldbusiness.com/member/view/2992204/mamr-enterprise.html,Malaysia,Cheras,NULL,NULL,NULL,NULL,NULL,NULL,NULL,NULL,NULL,NULL,NULL,NULL,NULL,NULL,NULL,NULL,Agnus Castus Powder; Alfalfa Juice Powder Gluten Free; Alfalfa Leaf Powder Gluten Free,Agnus Castus Extract & Products; Alfalfa Extract & Products,companies,2026-07-20
3996337,Silkflex Polymers Sdn Bhd,https://www.go4worldbusiness.com/member/view/3996337/silkflex-polymers-sdn-bhd.html,Malaysia,Pelabuhan Klang,"No.98 (Lot 9115) Jalan Tengah Ks 10, Telok Gong Pelabuhan Klang 42000 Selangor Malaysia",http://www.silkflex.com.my,+60-165620825,Josh Chai,International Business Manager,GOLD,"September, 2023",NULL,NULL,Silkflex Polymers Sdn Bhd,1985,Manufacturer/ OEM,Supplier,102,"Sells Water based screen printing textile inks water based wood coatings water based surface coatings (wood, masonry and metal).","Silkflex Polymers Sdn Bhd is a junior supplier from Pelabuhan Klang, Malaysia. They are a manufacturer/oem specializing in water based screen printing textile inks water based wood coatings water based surface coatings (wood, masonry and metal).. Founded in 1985. They list 102 products.",Agrimony Tops Extract,Agrimony Extract & Products,suppliers,2026-07-20
1649561,GTN Innovations Sdn Bhd,https://www.go4worldbusiness.com/member/view/1649561/gtn-innovations-sdn-bhd.html,Malaysia,Johor Bahru,"65, Jalan Molek 3/10 Taman Molek Johor Bahru 81100 Johor Malaysia",https://www.go4worldbusiness.com/member/view/1649561/gtn-innovations-sdn-bhd.html,NULL,Alvin Chia,Director,Premium,"November, 2018",NULL,NULL,GTN Innovations Sdn Bhd,2011,Manufacturer/ OEM,Supplier,29,NULL,"GTN Innovations Sdn Bhd is a junior supplier from Johor Bahru, Malaysia. They are a manufacturer/oem specializing in tempered glass manufacturer, nano coating, 9h coating and smartphone accessories. Founded in 2011, they report annual sales of USD 1 million to USD 5 million. They are EUIPO, REACH and Rohs certified. They list 29 products.",Agrimony Tops Extract,Agrimony Extract & Products,suppliers,2026-07-20
1616235,Dura Power SDN. BHD.,https://www.go4worldbusiness.com/member/view/1616235/dura-power-sdn-bhd-.html,Malaysia,Kulai,"3105a, Jalan Merbau 1 Bandar Baru Putra Kulai 81000 Johor Malaysia",https://www.go4worldbusiness.com/member/view/1616235/dura-power-sdn-bhd-.html,NULL,William,Manager,Premium,"August, 2018",NULL,NULL,Dura Power SDN. BHD.,1995,Manufacturer/ OEM,Supplier,7,NULL,"Dura Power SDN. BHD. is a junior supplier from Kulai, Malaysia. They are a manufacturer/oem specializing in apet, gag, petg and pp sheets & apet resin (granules. Founded in 1995, they report annual sales of USD 1 million to USD 5 million. They are ISO9001-2008 certified. They list 7 products.",Agrimony Tops Extract,Agrimony Extract & Products,suppliers,2026-07-20
2984017,Rodmax Export Import Sdn Bhd,https://www.go4worldbusiness.com/member/view/2984017/rodmax-export-import-sdn-bhd.html,Malaysia,KLANG,"110a,lebuh Turi,41200 Klang, Selangor Klang 41200 Selangor Malaysia",https://www.go4worldbusiness.com/member/view/2984017/rodmax-export-import-sdn-bhd.html,NULL,Sabah,Marketing Department,Premium,"July, 2020",NULL,NULL,Rodmax Export Import Sdn Bhd,2020,Dealer / Reseller,Supplier,4,Sells Gloves and nitrile medical examinations gloves and all types of gloves,"Rodmax Export Import Sdn Bhd is a junior supplier from KLANG, Malaysia. They are a dealer/reseller specializing in gloves and nitrile medical examinations gloves and all types of gloves. Founded in 2020. They list 4 products.",Agrimony Tops Extract,Agrimony Extract & Products,suppliers,2026-07-20
3597041,Ikatan Wibawa Sdn. Bhd.,https://www.go4worldbusiness.com/member/view/3597041/ikatan-wibawa-sdn-bhd-.html,Malaysia,Selangor,"B-21-13A Jalan Pusat Bandar Kompleks Evo 43650 Bandar Baru Bangi, Selangor Darul Ehsan Selangor Malaysia",https://www.go4worldbusiness.com/member/view/3597041/ikatan-wibawa-sdn-bhd-.html,NULL,Sanjay Kharpude,Sales Executive,Premium,"April, 2022",yes,Company Registration Certificate Verified,Ikatan Wibawa Sdn. Bhd.,2000,Dealer / Reseller,Supplier and Service Provider,6,"Sells Steam coal, iron ore and silica sand | Services We are having good mining sources from indonesia mines operation in indonesia mostly operating in the east and south of kalimantan. indonesia is one of the world's larger producers and ranks in the top five coal producers in the world.","Ikatan Wibawa Sdn. Bhd. is a junior supplier and service provider from Selangor, Malaysia. They are a dealer/reseller specializing in steam coal, iron ore and silica sand. They provide services such as we are having good mining sources from indonesia mines operation in indonesia mostly operating in the east and south of kalimantan. indonesia is one of the world's larger producers and ranks in the top five coal...",Agrimony Tops Extract,Agrimony Extract & Products,suppliers,2026-07-20
3283041,Galaxy Seven International Sdn Bhd,https://www.go4worldbusiness.com/member/view/3283041/galaxy-seven-international-sdn-bhd.html,Malaysia,Petaling jaya,"G 77/2, Zenith Corporate Park Ss7/26, Kelana Jaya, Petaling Jaya, 47301 Petaling Jaya 47301 Selangor Malaysia",http://www.glovesmadeinmalaysia.com,NULL,Imran Hasan,Managing Director,Premium,"April, 2021",yes,Company Registration Certificate Verified,Galaxy Seven International Sdn Bhd,2015,Distributor,Supplier,7,NULL,"Galaxy Seven International Sdn Bhd is a junior supplier from Petaling jaya, Malaysia. They are a distributor specializing in gloves made in malaysia and nitrile and latex and cpe gloves. Founded in 2015, they report annual sales of USD 5 million to USD 15 million. They are CE and ISO certified. They list 7 products.",Agrimony Tops Extract; Alfalfa Juice Powder Gluten Free; Alfalfa Leaf Powder Gluten Free,Agrimony Extract & Products; Alfalfa Extract & Products,suppliers,2026-07-20
192271,Fle (M) Sdn Bhd,https://www.go4worldbusiness.com/member/view/192271/fle-%28m%29-sdn-bhd.html,Malaysia,Petaling Jaya,"1 B, Jalan Ss21/1 A Damansara Utama Petaling Jaya 47400 Selangor Malaysia",http://www.fle.com.sg,NULL,Kevin,Regioal General Manager,Premium,"November, 2004",NULL,NULL,Fle (M) Sdn Bhd,1984,Service Provider,Buyer and Service Provider,NULL,NULL,"Fle (M) Sdn Bhd is a junior buyer and service provider from Petaling Jaya, Malaysia. They are a service provider for paper. They provide services such as dtp and writing. Founded in 1984, they report annual sales of USD 15 million to USD 25 million. They are ISO 9001 certified.",Agrimony Tops Extract,Agrimony Extract & Products,companies,2026-07-20
491753,Top Logic,https://www.go4worldbusiness.com/member/view/491753/top-logic.html,Malaysia,Seri Kembangan,"22 A, Jln Bs9/5c, Tmn Bukit Serdang Seri Kembangan 43300 Selangor Malaysia",https://www.go4worldbusiness.com/member/view/491753/top-logic.html,NULL,S. T. Sum,Director,Premium,"May, 2007",NULL,NULL,Top Logic,1999,Dealer / Reseller,Supplier,2,Sells Wood vinegar omri listed and biochar. and hardwood charcoal,"Top Logic is a junior supplier from Seri Kembangan, Malaysia. They are a dealer/reseller specializing in wood vinegar omri listed and biochar. and hardwood charcoal. Founded in 1999. They are ROC certified. They list 2 products.",Agrimony Tops Extract,Agrimony Extract & Products,companies,2026-07-20
3032738,Top Glove,https://www.go4worldbusiness.com/member/view/3032738/top-glove.html,Malaysia,NULL,- - Malaysia,https://www.go4worldbusiness.com/member/view/3032738/top-glove.html,NULL,Aina Cheung Phone: Not displayed by user.,NULL,Premium,"August, 2020",NULL,NULL,Top Glove,NULL,NULL,Supplier,NULL,Sells Nitrile gloves,Top Glove is a junior supplier from Malaysia. They supply nitrile gloves.,Agrimony Tops Extract,Agrimony Extract & Products,companies,2026-07-20
200721,Top Glove,https://www.go4worldbusiness.com/member/view/200721/top-glove.html,Malaysia,Klang,- Klang 41050 Selangor Malaysia,http://www.topglove.com.my,NULL,Km Lee,General Manager,Premium,"December, 2004",NULL,NULL,Top Glove,1991,Manufacturer/ OEM,Supplier,NULL,Sells Examination and surgical gloves,"Top Glove is a junior supplier from Klang, Malaysia. They are a manufacturer/oem specializing in examination and surgical gloves. Founded in 1991. They are CE, ISO 9001, CGSB, ADA, NF, TUV and FDA certified.",Agrimony Tops Extract,Agrimony Extract & Products,companies,2026-07-20
1335308,TOP Gloves,https://www.go4worldbusiness.com/member/view/1335308/top-gloves.html,Malaysia,Selangor,"Lot 4969, Jln Teratai, 6Th Miles,off Jln Meru Selangor 41050 Klang Malaysia",http://www.topglove.com.my,NULL,Ching Chong,Marketing Manager,Premium,"June, 2015",NULL,NULL,TOP Gloves,1991,Manufacturer/ OEM,"Buyer, Supplier and Service Provider",1,Sells Examination gloves | Buys Gloves | Services OEM/ Shipping across the country.,"TOP Gloves is a junior buyer, supplier and service provider from Selangor, Malaysia. They are a manufacturer/oem specializing in examination gloves. They are a manufacturer/oem for gloves. They provide services such as oem/shipping across the country.. Founded in 1991. They list 1 product.",Agrimony Tops Extract,Agrimony Extract & Products,companies,2026-07-20
557428,Top Green,https://www.go4worldbusiness.com/member/view/557428/top-green.html,Malaysia,Kuching,97 Star Garden Kuching 93150 Sarawak Malaysia,https://www.go4worldbusiness.com/member/view/557428/top-green.html,NULL,Dr Firdaus Abdullah,Managing Director,Premium,"November, 2007",NULL,NULL,Top Green,NULL,Distributor,Buyer and Supplier,NULL,Sells Agricultural | Buys Agricultural,"Top Green is a junior buyer and supplier from Kuching, Malaysia. They are a distributor specializing in agriculturals. They are a distributor for agricultural.",Agrimony Tops Extract,Agrimony Extract & Products,companies,2026-07-20
3885189,Top Glove,https://www.go4worldbusiness.com/member/view/3885189/top-glove.html,Malaysia,klang,"Meru, Klang, Selangor, Malaysia Klang 41050 Selangor Malaysia",https://www.go4worldbusiness.com/member/view/3885189/top-glove.html,NULL,Vikneswary A/p Rajendaren,Researcher,Premium,"April, 2023",NULL,NULL,Top Glove,1991,Manufacturer/ OEM,Buyer and Service Provider,NULL,Buys Sulphur | Services Manufacturing,"Top Glove is a junior buyer and service provider from klang, Malaysia. They are a manufacturer/oem for sulphur. They provide services such as manufacturing. Founded in 1991. They are ISO9000 certified.",Agrimony Tops Extract,Agrimony Extract & Products,companies,2026-07-20
3811768,Top Glove,https://www.go4worldbusiness.com/member/view/3811768/top-glove.html,Malaysia,NULL,Malaysia - Malaysia,https://www.go4worldbusiness.com/member/view/3811768/top-glove.html,NULL,Munirah Amelia Phone: Not displayed by user.,NULL,Premium,"January, 2023",NULL,NULL,Top Glove,2023,NULL,Supplier,NULL,Sells Used machine,Top Glove is a junior supplier from Malaysia. They supply used machine. Founded in 2023.,Agrimony Tops Extract,Agrimony Extract & Products,companies,2026-07-20
3273639,Top Feel,https://www.go4worldbusiness.com/member/view/3273639/top-feel.html,Malaysia,Shah Alam,"No.16, Persiaran Setia Dagang, Setia Alam, Seksyen U13, 40170 Shah Alam, Selangor Shah Alam 40170 Selangor Malaysia",https://www.go4worldbusiness.com/member/view/3273639/top-feel.html,NULL,Poulin,Executive,Premium,"April, 2021",NULL,NULL,Top Feel,2018,Manufacturer/ OEM,Buyer and Supplier,NULL,Sells Face mask and condoms | Buys Meltblown,"Top Feel is a junior buyer and supplier from Shah Alam, Malaysia. They are a manufacturer/oem specializing in face mask and condoms. They are a manufacturer/oem for meltblown. Founded in 2018. They are ISO 13485 certified.",Agrimony Tops Extract,Agrimony Extract & Products,companies,2026-07-20
2942600,Top Logic,https://www.go4worldbusiness.com/member/view/2942600/top-logic.html,Malaysia,Petaling Jaya,27 Jalan PJU 5/12 Petaling Jaya 47810 Selangor Malaysia,https://www.go4worldbusiness.com/member/view/2942600/top-logic.html,NULL,Jinjin,Executive,Premium,"June, 2020",NULL,NULL,Top Logic,2010,Dealer / Reseller,Supplier,4,Sells Recycled Plastics and Stocklots,"Top Logic is a junior supplier from Petaling Jaya, Malaysia. They are a dealer/reseller specializing in recycled plastics and stocklots. Founded in 2010, they report annual sales of around USD 250,000. They list 4 products.",Agrimony Tops Extract,Agrimony Extract & Products,companies,2026-07-20
2797813,Top Glove,https://www.go4worldbusiness.com/member/view/2797813/top-glove.html,Malaysia,Klang,"Pt64593, Jalan Dahlia / Ku8, Kawasan Perindustrian Meru Timur Klang 41050 Selangor Malaysia",http://topglove.com,NULL,Nicholas Phone: Not displayed by user.,NULL,Premium,"February, 2020",NULL,NULL,Top Glove,1991,Manufacturer/ OEM,Supplier,NULL,Sells Gloves,"Top Glove is a junior supplier from Klang, Malaysia. They are a manufacturer/oem specializing in gloveses. Founded in 1991.",Agrimony Tops Extract,Agrimony Extract & Products,companies,2026-07-20
1469712,Top Logic,https://www.go4worldbusiness.com/member/view/1469712/top-logic.html,Malaysia,Seri Kembangan,"22A, JLN BS9/5C, Tmn Bukit Serdang Seri Kembangan 43300 Selangor Malaysia",https://www.go4worldbusiness.com/member/view/1469712/top-logic.html,NULL,S. T. Sum Phone: Not displayed by user.,NULL,Premium,"April, 2017",NULL,NULL,Top Logic,2010,Dealer / Reseller,Supplier,NULL,Sells Waste rubber,"Top Logic is a junior supplier from Seri Kembangan, Malaysia. They are a dealer/reseller specializing in waste rubber. Founded in 2010, they report annual sales of around USD 250,000.",Agrimony Tops Extract,Agrimony Extract & Products,companies,2026-07-20
1483110,Top Glove,https://www.go4worldbusiness.com/member/view/1483110/top-glove.html,Malaysia,Shah Alam,"Top Glove Sdn Bhd Level 21, Top Glove Tower 16 Persiaran Setia Dagang Setia Alam, Seksyen U13 Shah Alam 40170 Selangor Malaysia",http://www.topglove.com,NULL,Benson,General Manager - Marketing,Premium,"June, 2017",NULL,NULL,Top Glove,1991,Manufacturer/ OEM,Supplier and Service Provider,NULL,Sells Glove Products | Services Manufacturer & exporter,"Top Glove is a junior supplier and service provider from Shah Alam, Malaysia. They are a manufacturer/oem specializing in glove products. They provide services such as manufacturer & exporter. Founded in 1991, they report annual sales of more than USD 100 million.",Agrimony Tops Extract,Agrimony Extract & Products,companies,2026-07-20
692340,Little Corner Clothing,https://www.go4worldbusiness.com/member/view/692340/little-corner-clothing.html,Malaysia,Kuching,No. 13F Lorong 2 Tabuan Laru Kuching 93350 Sarawak Malaysia,http://www.littlecornerclothing.blogspot.com,NULL,Josephine,Manager,Premium,"November, 2008",NULL,NULL,Little Corner Clothing,NULL,Dealer / Reseller,Supplier,1,Sells Tank top,"Little Corner Clothing is a junior supplier from Kuching, Malaysia. They are a dealer/reseller specializing in tank top. They list 1 product.",Agrimony Tops Extract,Agrimony Extract & Products,companies,2026-07-20
3068155,Top Gorgeous Trading,https://www.go4worldbusiness.com/member/view/3068155/top-gorgeous-trading.html,Malaysia,Kuala Lumpur,"Kuala Lumpur, Malaysia Kuala Lumpur Malaysia",https://www.go4worldbusiness.com/member/view/3068155/top-gorgeous-trading.html,NULL,Shermaine,Director,Premium,"September, 2020",NULL,NULL,Top Gorgeous Trading,2020,Buying Agent,Supplier,NULL,Sells Face mask,"Top Gorgeous Trading is a junior supplier from Kuala Lumpur, Malaysia. They are a buying agent specializing in face mask. Founded in 2020.",Agrimony Tops Extract,Agrimony Extract & Products,companies,2026-07-20
2954608,Top Supply Industries,https://www.go4worldbusiness.com/member/view/2954608/top-supply-industries.html,Malaysia,Kota Kinabalu,P.o Box 50660 Kota Kinabalu 88725 Putatan Sabah Malaysia,https://www.go4worldbusiness.com/member/view/2954608/top-supply-industries.html,NULL,Polonia Gabing,Manager,Premium,"June, 2020",NULL,NULL,Top Supply Industries,2017,Dealer / Reseller,Buyer and Supplier,NULL,Sells Kitchen items | Buys Cooler box and water dispenser,"Top Supply Industries is a junior buyer and supplier from Kota Kinabalu, Malaysia. They are a dealer/reseller specializing in kitchen items. They are a dealer/reseller for cooler box and water dispenser. Founded in 2017.",Agrimony Tops Extract,Agrimony Extract & Products,companies,2026-07-20
2836208,Vic Top 88,https://www.go4worldbusiness.com/member/view/2836208/vic-top-88.html,Malaysia,Johor Bahru,Jalan Kebun Teh 2 #07-09 Johor Bahru 80250 Johor Malaysia,https://www.go4worldbusiness.com/member/view/2836208/vic-top-88.html,NULL,Victor Gan,Manager,Premium,"March, 2020",NULL,NULL,Vic Top 88,NULL,Buying Agent,Buyer and Service Provider,NULL,Buys Surgical mask | Services Agent,"Vic Top 88 is a junior buyer and service provider from Johor Bahru, Malaysia. They are a buying agent for surgical mask. They provide services such as agent.",Agrimony Tops Extract,Agrimony Extract & Products,companies,2026-07-20
1778431,Top Deluxe Freshmart,https://www.go4worldbusiness.com/member/view/1778431/top-deluxe-freshmart.html,Malaysia,Johor Bahru,NULL,NULL,NULL,NULL,NULL,NULL,NULL,NULL,NULL,NULL,NULL,NULL,NULL,NULL,NULL,NULL,Agrimony Tops Extract,Agrimony Extract & Products,companies,2026-07-20
798888,Top Notch Solutions,https://www.go4worldbusiness.com/member/view/798888/top-notch-solutions.html,Malaysia,Kuala Lumpur,NULL,NULL,NULL,NULL,NULL,NULL,NULL,NULL,NULL,NULL,NULL,NULL,NULL,NULL,NULL,NULL,Agrimony Tops Extract,Agrimony Extract & Products,companies,2026-07-20
977005,Ever Top Recycle,https://www.go4worldbusiness.com/member/view/977005/ever-top-recycle.html,Malaysia,Kuala Lumpur,NULL,NULL,NULL,NULL,NULL,NULL,NULL,NULL,NULL,NULL,NULL,NULL,NULL,NULL,NULL,NULL,Agrimony Tops Extract,Agrimony Extract & Products,companies,2026-07-20
533289,Prominent Apparels,https://www.go4worldbusiness.com/member/view/533289/prominent-apparels.html,Malaysia,Selangor Darul Ehsan,NULL,NULL,NULL,NULL,NULL,NULL,NULL,NULL,NULL,NULL,NULL,NULL,NULL,NULL,NULL,NULL,Agrimony Tops Extract,Agrimony Extract & Products,companies,2026-07-20
1413473,Hairi Sdn. Bhd,https://www.go4worldbusiness.com/member/view/1413473/hairi-sdn-bhd.html,Malaysia,Alor Gajah,Km 3296 Jalan Sutera 2 Alor Gajah 78000 Melaka Malaysia,https://www.go4worldbusiness.com/member/view/1413473/hairi-sdn-bhd.html,NULL,Mohammad Phone: Not displayed by user.,NULL,Premium,"July, 2016",NULL,NULL,Hairi Sdn. Bhd,NULL,Dealer / Reseller,Supplier,NULL,"Sells D2, JET FUEL and MAZUT","Hairi Sdn. Bhd is a junior supplier from Alor Gajah, Malaysia. They are a dealer/reseller specializing in d2, jet fuel, mazut and d6. They report annual sales of USD 15 million to USD 25 million.",Hairy Agrimony Herb Powder,Agrimony Extract & Products,companies,2026-07-20
1536832,MKZ Global Ventures,https://www.go4worldbusiness.com/member/view/1536832/mkz-global-ventures.html,Malaysia,Seri Kembangan,No 2146-C Jalan Kolej Seri Kembangan 43300 Selangor Malaysia,https://www.go4worldbusiness.com/member/view/1536832/mkz-global-ventures.html,NULL,Khaidhir Muhammad,Manager,Premium,"January, 2018",NULL,NULL,MKZ Global Ventures,2015,Dealer / Reseller,Supplier,NULL,Sells Herbal powder and herbs,"MKZ Global Ventures is a junior supplier from Seri Kembangan, Malaysia. They are a dealer/reseller specializing in herbal powder and herbs. Founded in 2015.",Hairy Agrimony Herb Powder,Agrimony Extract & Products,companies,2026-07-20
561066,Hpa,https://www.go4worldbusiness.com/member/view/561066/hpa.html,Malaysia,Johor Bahru,"No.18, Jalan Jambu 9, Taman Kota Masai Pasir Gudang Johor Bahru 81700 Johor Malaysia",https://www.go4worldbusiness.com/member/view/561066/hpa.html,NULL,Tinie,Dealer,Premium,"December, 2007",NULL,NULL,Hpa,NULL,Dealer / Reseller,Supplier,NULL,Sells Herbs,"Hpa is a junior supplier from Johor Bahru, Malaysia. They are a dealer/reseller specializing in herbses.",Hairy Agrimony Herb Powder,Agrimony Extract & Products,companies,2026-07-20
914914,IMP Solution Herbs Worldwide,https://www.go4worldbusiness.com/member/view/914914/imp-solution-herbs-worldwide.html,Malaysia,Ulu Kinta,Lot B 11&12 Kawasan Industrial Mara Jalan Tambun U Ulu Kinta 681000 Perak Malaysia,https://www.go4worldbusiness.com/member/view/914914/imp-solution-herbs-worldwide.html,NULL,Mohd Fauzi,Ceo,Premium,"July, 2010",NULL,NULL,IMP Solution Herbs Worldwide,NULL,Manufacturer/ OEM,Buyer and Supplier,NULL,"Sells Herbs | Buys Raw pumpkin, cocoa beans and soybean","IMP Solution Herbs Worldwide is a junior buyer and supplier from Ulu Kinta, Malaysia. They are a manufacturer/oem specializing in herbses. They are a manufacturer/oem for raw pumpkin, cocoa beans, soybean and curry leaves dry stevia leaf.",Hairy Agrimony Herb Powder,Agrimony Extract & Products,companies,2026-07-20
