company_id,company_name,company_profile_url,country,city,address,website,phone,contact_person,contact_designation,member_status,member_since,verified,verification_details,legal_entity,established_year,primary_business,role,products_listed_count,deal_focus,description,search_terms,category_types,search_tab,scrape_date
366780,Hybridge Trading Sdn Bhd,https://www.go4worldbusiness.com/member/view/366780/hybridge-trading-sdn-bhd.html,Malaysia,Wp,"Concourse, Selangor Turf Club Jalan Sg. Besi WP 57100 Selangor Malaysia",https://www.go4worldbusiness.com/member/view/366780/hybridge-trading-sdn-bhd.html,NULL,Rajsonia Dhaliwal,Ceo,Premium,"March, 2006",NULL,NULL,Hybridge Trading Sdn Bhd,1997,Distributor,Supplier,NULL,NULL,"Hybridge Trading Sdn Bhd is a junior supplier from Wp, Malaysia. They are a distributor specializing in fruit juices, pineapple, confectionary and candy. Founded in 1997, they report annual sales of USD 15 million to USD 25 million. They are HALAL, ISO, HAACP and GMP certified. They list 11 products.",Acai Berry Fruit Juice Powder; Acerola Cherry Fruit Juice Extract; Acerola Cherry Fruit Juice Powder,Acai Berry Extract & Products; Acerola Cherry Extract & Products,suppliers,2026-07-20
371881,Enjoy Goodhealth Enterprise,https://www.go4worldbusiness.com/member/view/371881/enjoy-goodhealth-enterprise.html,Malaysia,Keningau,P.o Box 260 Keningau 89007 Sabah Malaysia,https://www.go4worldbusiness.com/member/view/371881/enjoy-goodhealth-enterprise.html,NULL,Geoffrey Allen Sabayoi,Manager,Premium,"March, 2006",NULL,NULL,Enjoy Goodhealth Enterprise,2005,Distributor,Supplier,4,NULL,"Enjoy Goodhealth Enterprise is a junior supplier from Keningau, Malaysia. They are a distributor specializing in juice concentrate, fruit flavoured cordial, ready to drink juice and instant coffee. Founded in 2005, they report annual sales of USD 1 million to USD 5 million. They list 4 products.",Acai Berry Fruit Juice Powder; Acerola Cherry Fruit Juice Extract; Acerola Cherry Fruit Juice Powder; Agaricus Blazei Mushroom Fungus Fruiting Body Powder; Agarikon Mushroom Fungus Fruiting Body Powder Polysaccharides,Acai Berry Extract & Products; Acerola Cherry Extract & Products; Agaricus Extract & Products; Agarikon Extract & Products,suppliers,2026-07-20
3329214,Arabic Village Sdn Bhd,https://www.go4worldbusiness.com/member/view/3329214/arabic-village-sdn-bhd.html,Malaysia,Kuala Lumpur,"No 21, Jalan Mamanda 4, Taman Dato Ahmad Razali, 68000 Ampang, Selangor Kuala Lumpur 68000 Selangor Malaysia",https://www.go4worldbusiness.com/member/view/3329214/arabic-village-sdn-bhd.html,NULL,Sarah Mj,Business Developer Manager,Premium,"June, 2021",NULL,NULL,Arabic Village Sdn Bhd,2014,Distributor,Supplier,3,"Sells Halal malt drinks (barbican), fruit juice (rani) and pistachio nuts","Arabic Village Sdn Bhd is a junior supplier from Kuala Lumpur, Malaysia. They are a distributor specializing in halal malt drinks (barbican), fruit juice (rani), pistachio nuts and dried fruits. Founded in 2014. They list 3 products.",Acai Berry Fruit Juice Powder; Acerola Cherry Fruit Juice Extract; Acerola Cherry Fruit Juice Powder,Acai Berry Extract & Products; Acerola Cherry Extract & Products,suppliers,2026-07-20
3126894,Hex Export Trading,https://www.go4worldbusiness.com/member/view/3126894/hex-export-trading.html,Malaysia,Cyberjaya,"16, Jalan Mozart 1a, Symphony Hills Cyberjaya 63000 Selangor Malaysia",https://www.go4worldbusiness.com/member/view/3126894/hex-export-trading.html,NULL,Hazman Lo Phone: Not displayed by user.,NULL,Premium,"November, 2020",yes,NULL,Hex Export Trading,2020,Dealer / Reseller,Supplier,9,"Sells All types of commodities such as medical equipment, agro and fresh fruits and vegetables","Hex Export Trading is a junior supplier from Cyberjaya, Malaysia. They are a dealer/reseller specializing in all types of commodities such as medical equipment, agro, fresh fruits and vegetables and sunflower seeds. Founded in 2020, they report annual sales of around USD 250,000. They list 9 products.",Acai Berry Fruit Juice Powder; Acai Berry Fruit Powder; Acerola Cherry Fruit Juice Powder; Agaricus Blazei Mushroom Fungus Fruiting Body Powder; Agarikon Mushroom Fungus Fruiting Body Powder Polysaccharides; Agnus Castus Powder; Hairy Agrimony Herb Powder; Ajwain Seed Extract; Akarkara Root Powder; Alder Buckthorn Bark Powder; Alfalfa Powder,Acai Berry Extract & Products; Acerola Cherry Extract & Products; Agaricus Extract & Products; Agarikon Extract & Products; Agnus Castus Extract & Products; Agrimony Extract & Products; Ajwain Extract & Products; Akarkara Extract & Products; Alder Buckthorn Extract & Products; Alfalfa Extract & Products,suppliers,2026-07-20
2780881,Sepri Natural Products,https://www.go4worldbusiness.com/member/view/2780881/sepri-natural-products.html,Malaysia,Rembau,"The Farm Is At No 2, Pusat Pertanian Kendong Rembau 71350 Negeri Sembilan Malaysia",http://www.seprinatural.com,NULL,Jefferi,Manager,Premium,"January, 2020",NULL,NULL,Sepri Natural Products,2015,Manufacturer/ OEM,Supplier,3,"Sells Organic certified soursop leaf tea in sachets, soursop frozen fruit pulp and soursop fruit powder and leaf tea in drums.","Sepri Natural Products is a junior supplier from Rembau, Malaysia. They are a manufacturer/oem specializing in organic certified soursop leaf tea in sachets, soursop frozen fruit pulp and soursop fruit powder and leaf tea in drums.. Founded in 2015. They are MS 1529:2015 & PPKM 2009(MeSTI) certified. They list 3 products.",Acai Berry Fruit Juice Powder; Acai Berry Fruit Powder; Acerola Cherry Fruit Juice Powder; Agaricus Blazei Mushroom Fungus Fruiting Body Powder; Agarikon Mushroom Fungus Fruiting Body Powder Polysaccharides,Acai Berry Extract & Products; Acerola Cherry Extract & Products; Agaricus Extract & Products; Agarikon Extract & Products,suppliers,2026-07-20
3139816,Bio Q Solution Plt,https://www.go4worldbusiness.com/member/view/3139816/bio-q-solution-plt.html,Malaysia,Subang Jaya,"No.8-2, First Floor, Jalan Putra Indah 9/21, One City Subang Jaya 47650 Selangor Malaysia",https://www.go4worldbusiness.com/member/view/3139816/bio-q-solution-plt.html,NULL,Khairul Anwar Nadzri,Manager,Premium,"November, 2020",yes,Company Registration Certificate Verified,Bio Q Solution Plt,2020,Distributor,Supplier,1,"Sells Palm oil, palm fatty acid and goat uht milk (ready to consume product)","Bio Q Solution Plt is a junior supplier from Subang Jaya, Malaysia. They are a distributor specializing in palm oil, palm fatty acid, goat uht milk (ready to consume product) and fresh fruit. Founded in 2020. They are Malaysia HACCP and MyGAP certified. They list 1 product.",Acai Berry Fruit Juice Powder; Acerola Cherry Fruit Juice Extract; Acerola Cherry Fruit Juice Powder; Agaricus Blazei Mushroom Fungus Fruiting Body Powder; Agarikon Mushroom Fungus Fruiting Body Powder Polysaccharides,Acai Berry Extract & Products; Acerola Cherry Extract & Products; Agaricus Extract & Products; Agarikon Extract & Products,suppliers,2026-07-20
882408,Intuit Enterprise,https://www.go4worldbusiness.com/member/view/882408/intuit-enterprise.html,Malaysia,Petaling Jaya,"5, Jalan Ss 1/33 Kg. Tunku Petaling Jaya 47300 Selangor Malaysia",https://www.go4worldbusiness.com/member/view/882408/intuit-enterprise.html,NULL,Amirthalingam,Proprietor,Premium,"April, 2010",NULL,NULL,Intuit Enterprise,2009,Buying Agent,Supplier and Service Provider,1,NULL,"Intuit Enterprise is a junior supplier and service provider from Petaling Jaya, Malaysia. They are a buying agent specializing in mangos teen juice an antioxidant health drink. They provide services such as buying agent. Founded in 2009, they report annual sales of around USD 250,000. They list 1 product.",Acai Berry Fruit Juice Powder; Acerola Cherry Fruit Juice Extract; Acerola Cherry Fruit Juice Powder,Acai Berry Extract & Products; Acerola Cherry Extract & Products,suppliers,2026-07-20
1540486,Ace Prima Resources,https://www.go4worldbusiness.com/member/view/1540486/ace-prima-resources.html,Malaysia,Petaling Jaya,"1286, Block A1, Pjs8/9 Petaling Jaya 46150 Selangor Malaysia",http://www.aceprimaresources.com.my,NULL,Silambarasan,Sales Manager,Premium,"January, 2018",NULL,NULL,Ace Prima Resources,2015,Dealer / Reseller,Buyer and Supplier,22,"Sells Fatty acids: caproic, caprylic and capric | Buys Crude glycerine and oleochemicals products","Ace Prima Resources is a junior buyer and supplier from Petaling Jaya, Malaysia. They are a dealer/reseller specializing in fatty acids: caproic, caprylic, capric and lauric. They are a dealer/reseller for crude glycerine and oleochemicals products. Founded in 2015. They list 22 products.",Acai Berry Fruit Juice Powder; Acerola Cherry Fruit Juice Extract; Acerola Cherry Fruit Juice Powder; Adipic Acid,Acai Berry Extract & Products; Acerola Cherry Extract & Products; Adipic Acid,suppliers,2026-07-20
3099796,Haco Asia Pacific Sdn Bhd,https://www.go4worldbusiness.com/member/view/3099796/haco-asia-pacific-sdn-bhd.html,Malaysia,Shah Alam,"Lot 5, Jalan Sungai Kayu Ara 32/37, Taman Berjaya, Seksyen 32, 40460 Shah Alam, Selangor Darul Ehsan, Malaysia. Taman Berjaya, Seksyen 32, 40460 Shah Alam, Selangor Darul Ehsan, Malaysia. Shah Alam 40460 Selangor Malaysia",http://www.hacoasiapacific.com,NULL,Catherine Ng Phone: Not displayed by user.,NULL,Premium,"October, 2020",NULL,NULL,Haco Asia Pacific Sdn Bhd,2004,Manufacturer/ OEM,Supplier,14,"Sells Spray Dried Coffee, Freeze Dried Coffee and Roasted Whole Beans","Haco Asia Pacific Sdn Bhd is a junior supplier from Shah Alam, Malaysia. They are a manufacturer/oem specializing in spray dried coffee, freeze dried coffee, roasted whole beans and roast & ground coffee. Founded in 2004. They list 14 products.",Acai Berry Fruit Juice Powder; Agaricus Blazei Mushroom Fungus Fruiting Body Powder; Agarikon Mushroom Fungus Fruiting Body Powder Polysaccharides,Acai Berry Extract & Products; Agaricus Extract & Products; Agarikon Extract & Products,suppliers,2026-07-20
3568723,Express Agro Products Sdn Bhd,https://www.go4worldbusiness.com/member/view/3568723/express-agro-products-sdn-bhd.html,Malaysia,Kota Kinabalu,65 Gaya Street Kota Kinabalu 88800 Sabah Malaysia,https://www.go4worldbusiness.com/member/view/3568723/express-agro-products-sdn-bhd.html,NULL,Douglas Lind,Chairman,Premium,"March, 2022",yes,Company Registration Certificate Verified,Express Agro Products Sdn Bhd,2021,Manufacturer/ OEM,Supplier,1,Sells Banana powder,"Express Agro Products Sdn Bhd is a junior supplier from Kota Kinabalu, Malaysia. They are a manufacturer/oem specializing in banana powder. Founded in 2021. They list 1 product.",Acai Berry Fruit Juice Powder; Acai Berry Fruit Powder; Acerola Cherry Fruit Juice Powder; Agaricus Blazei Mushroom Fungus Fruiting Body Powder; Agarikon Mushroom Fungus Fruiting Body Powder Polysaccharides; Agnus Castus Powder; Akarkara Root Powder; Alder Buckthorn Bark Powder; Alfalfa Powder,Acai Berry Extract & Products; Acerola Cherry Extract & Products; Agaricus Extract & Products; Agarikon Extract & Products; Agnus Castus Extract & Products; Akarkara Extract & Products; Alder Buckthorn Extract & Products; Alfalfa Extract & Products,suppliers,2026-07-20
1891819,Charge Trade & Distribution,https://www.go4worldbusiness.com/member/view/1891819/charge-trade-distribution.html,Malaysia,Sungai Buloh,"No.9, Jalan Anggerik 3, Taman Saujana Utama Sungai Buloh 47000 Selangor Malaysia",https://www.go4worldbusiness.com/member/view/1891819/charge-trade-distribution.html,NULL,Mohamad Apandi Ishak,Founder,Premium,"October, 2019",NULL,NULL,Charge Trade & Distribution,2017,Manufacturer/ OEM,"Buyer, Supplier and Service Provider",NULL,Sells Fruit juice mangosteen ready to drink | Buys Mangosteen fruit | Services Manufacturer,"Charge Trade & Distribution is a junior buyer, supplier and service provider from Sungai Buloh, Malaysia. They are a manufacturer/oem specializing in fruit juice mangosteen ready to drink. They are a manufacturer/oem for mangosteen fruit. They provide services such as manufacturer. Founded in 2017, they report annual sales of around USD 250,000. They are HACCP certified.",Acai Berry Fruit Juice Powder; Acerola Cherry Fruit Juice Extract; Acerola Cherry Fruit Juice Powder,Acai Berry Extract & Products; Acerola Cherry Extract & Products,suppliers,2026-07-20
1550144,Smartbiz Dynamic Synergy,https://www.go4worldbusiness.com/member/view/1550144/smartbiz-dynamic-synergy.html,Malaysia,Subang Jaya,A-5-10 Empire Tower Jalan Ss16/1 Subang Jaya 47500 Selangor Malaysia,http://www.globaltrade.com.my,NULL,Nurul,Marketing Manager,Premium,"March, 2018",NULL,NULL,Smartbiz Dynamic Synergy,2017,Buying Agent,Supplier and Service Provider,1,"Sells Coffee and tea powder, flavored fruity and milkshake powder and concentrated fruit juice | Services Transportation and shipping (to selected countries)","Smartbiz Dynamic Synergy is a junior supplier and service provider from Subang Jaya, Malaysia. They are a buying agent specializing in coffee and tea powder, flavored fruity and milkshake powder, concentrated fruit juice and beverages. They provide services such as transportation and shipping (to selected countries). Founded in 2017. They are JAKIM Malaysia, HACCP and GMP certified. They list 1 product.",Acai Berry Fruit Juice Powder; Acai Berry Fruit Powder; Acerola Cherry Fruit Juice Extract; Acerola Cherry Fruit Juice Powder; Agaricus Blazei Mushroom Fungus Fruiting Body Powder; Agarikon Mushroom Fungus Fruiting Body Powder Polysaccharides,Acai Berry Extract & Products; Acerola Cherry Extract & Products; Agaricus Extract & Products; Agarikon Extract & Products,suppliers,2026-07-20
4255660,Bk Smart Resources (m) Sdn Bhd,https://www.go4worldbusiness.com/member/view/4255660/bk-smart-resources-%28m%29-sdn-bhd.html,Malaysia,Merlimau,Jalan Mhhf2/2 Melaka Halal Hub Phase 2 Merlimau 77300 Melaka Malaysia,https://www.go4worldbusiness.com/member/view/4255660/bk-smart-resources-%28m%29-sdn-bhd.html,NULL,Burhanuddin Kahar,Marketing Director,Premium,"August, 2024",NULL,NULL,Bk Smart Resources (m) Sdn Bhd,2019,Manufacturer/ OEM,Supplier,NULL,Sells 100% natural bottled and frozen sugarcane juice,"Bk Smart Resources (m) Sdn Bhd is a junior supplier from Merlimau, Malaysia. They are a manufacturer/oem specializing in 100% natural bottled and frozen sugarcane juice. Founded in 2019, they report annual sales of around USD 250,000.",Acai Berry Fruit Juice Powder; Acerola Cherry Fruit Juice Extract; Acerola Cherry Fruit Juice Powder,Acai Berry Extract & Products; Acerola Cherry Extract & Products,suppliers,2026-07-20
1691835,Bestrezq,https://www.go4worldbusiness.com/member/view/1691835/bestrezq.html,Malaysia,Cheras Kuala Lumpur,"39 Jalan Pakis, Ferngrove Taman Cuepacs Cheras Kuala Lumpur 43200 Selangor Malaysia",https://www.go4worldbusiness.com/member/view/1691835/bestrezq.html,NULL,Farah Phone: Not displayed by user.,NULL,Premium,"January, 2019",NULL,NULL,Bestrezq,2010,NULL,Supplier,NULL,Sells Fruit juice,"Bestrezq is a junior supplier from Cheras Kuala Lumpur, Malaysia. They supply fruit juice. Founded in 2010. They are 1974 certified.",Acai Berry Fruit Juice Powder; Acerola Cherry Fruit Juice Extract; Acerola Cherry Fruit Juice Powder,Acai Berry Extract & Products; Acerola Cherry Extract & Products,suppliers,2026-07-20
4243003,Golden Pom SDN BHD,https://www.go4worldbusiness.com/member/view/4243003/golden-pom-sdn-bhd.html,Malaysia,Kuala Lumpur,2 Jalan 2/153 A Taman Angkasa Off Jalan Puchong. Kuala Lumpur 58200 Kuala Lumpur Malaysia,https://www.go4worldbusiness.com/member/view/4243003/golden-pom-sdn-bhd.html,NULL,Revin,Admin.,GOLD,"August, 2024",NULL,NULL,Golden Pom SDN BHD,2013,Distributor,Supplier,NULL,Sells Fruits & Juice and Pomegranate Fruit & Pomegranate Juice.,"Golden Pom SDN BHD is a junior supplier from Kuala Lumpur, Malaysia. They are a distributor specializing in fruits & juice and pomegranate fruit & pomegranate juice.. Founded in 2013.",Acai Berry Fruit Juice Powder; Acerola Cherry Fruit Juice Extract; Acerola Cherry Fruit Juice Powder,Acai Berry Extract & Products; Acerola Cherry Extract & Products,suppliers,2026-07-20
1624617,Kara F&B Productions Sdn Bhd,https://www.go4worldbusiness.com/member/view/1624617/kara-f-b-productions-sdn-bhd.html,Malaysia,Selangor,"No.5, Jalan Signature Industrial Park 2 Signature Industrial Park, Semenyih Selangor 43500 Malaysia",https://www.go4worldbusiness.com/member/view/1624617/kara-f-b-productions-sdn-bhd.html,NULL,Sharon Chui,Managing Director,Premium,"September, 2018",NULL,NULL,Kara F&B Productions Sdn Bhd,NULL,Manufacturer/ OEM,Supplier,NULL,Sells High pressure processed (HPP)frozen & chilled fruit and vegetable juices and high pressure processed (HPP) frozen fruit paste & purees,"Kara F&B Productions Sdn Bhd is a junior supplier from Selangor, Malaysia. They are a manufacturer/oem specializing in high pressure processed (hpp)frozen & chilled fruit and vegetable juices and high pressure processed (hpp) frozen fruit paste & purees. They are HACCP and Halal certified.",Acai Berry Fruit Juice Powder; Acerola Cherry Fruit Juice Extract; Acerola Cherry Fruit Juice Powder,Acai Berry Extract & Products; Acerola Cherry Extract & Products,suppliers,2026-07-20
1787242,"Smi Argobase, Malaysia",https://www.go4worldbusiness.com/member/view/1787242/smi-argobase-malaysia.html,Malaysia,Kuala Lumpur,"24 Jalan Selar 1, Taman Pertama Kuala Lumpur 56000 Cheras Malaysia",https://www.go4worldbusiness.com/member/view/1787242/smi-argobase-malaysia.html,NULL,Dr. Duncan Ting,Exporter Manager,Premium,"June, 2019",NULL,NULL,"Smi Argobase, Malaysia",2019,Manufacturer/ OEM,Supplier,NULL,"Sells Tropical fresh fruits & dried fruits, fruit powder and fruit jams","Smi Argobase, Malaysia is a junior supplier from Kuala Lumpur, Malaysia. They are a manufacturer/oem specializing in tropical fresh fruits & dried fruits, fruit powder, fruit jams and fruit juice. Founded in 2019, they report annual sales of USD 250,000 to USD 1 million. They are ISO 9000 N 12000 certified.",Acai Berry Fruit Juice Powder; Acai Berry Fruit Powder; Acerola Cherry Fruit Juice Extract; Acerola Cherry Fruit Juice Powder; Agaricus Blazei Mushroom Fungus Fruiting Body Powder; Agarikon Mushroom Fungus Fruiting Body Powder Polysaccharides,Acai Berry Extract & Products; Acerola Cherry Extract & Products; Agaricus Extract & Products; Agarikon Extract & Products,suppliers,2026-07-20
96195,ITS Good Food & Beverages Sdn Bhd,https://www.go4worldbusiness.com/member/view/96195/its-good-food-beverages-sdn-bhd.html,Malaysia,Kuala Lumpur,"37, Jalan K3, Taman Melawati Kuala Lumpur 53100 Federal Territory Malaysia",https://www.go4worldbusiness.com/member/view/96195/its-good-food-beverages-sdn-bhd.html,NULL,Shah,Director,Premium,"June, 2003",NULL,NULL,ITS Good Food & Beverages Sdn Bhd,1995,Manufacturer/ OEM,Supplier,NULL,Sells Kiwi fruit juice,"ITS Good Food & Beverages Sdn Bhd is a junior supplier from Kuala Lumpur, Malaysia. They are a manufacturer/oem specializing in kiwi fruit juice. Founded in 1995.",Acai Berry Fruit Juice Powder; Acerola Cherry Fruit Juice Extract; Acerola Cherry Fruit Juice Powder,Acai Berry Extract & Products; Acerola Cherry Extract & Products,suppliers,2026-07-20
546698,Global Trading Enterprise,https://www.go4worldbusiness.com/member/view/546698/global-trading-enterprise.html,Malaysia,Kota Bharu,1955 Taman Anjaria Jalan Pengkalan Chepa Kota Bharu 15400 Kelantan Malaysia,https://www.go4worldbusiness.com/member/view/546698/global-trading-enterprise.html,NULL,Hendra Pawitra,Director,Premium,"October, 2007",NULL,NULL,Global Trading Enterprise,NULL,Distributor,Supplier,NULL,Sells Morinda citrofolia,"Global Trading Enterprise is a junior supplier from Kota Bharu, Malaysia. They are a distributor specializing in morinda citrofolia. They report annual sales of USD 250,000 to USD 1 million.",Acai Berry Fruit Juice Powder; Acerola Cherry Fruit Juice Extract; Acerola Cherry Fruit Juice Powder,Acai Berry Extract & Products; Acerola Cherry Extract & Products,companies,2026-07-20
3949453,Optastar Protein Sdn Bhd,https://www.go4worldbusiness.com/member/view/3949453/optastar-protein-sdn-bhd.html,Malaysia,Kuala Lumpur,"A-03-02, Medan Connaught Center Point, 56000 Kuala Lumpur Kuala Lumpur 56000 Kuala Lumpur Malaysia",https://www.go4worldbusiness.com/member/view/3949453/optastar-protein-sdn-bhd.html,NULL,Zulfaqqar,Chief Operating Officer,Premium,"July, 2023",NULL,NULL,Optastar Protein Sdn Bhd,2019,Manufacturer/ OEM,Supplier,NULL,"Sells Beverages, juice and protein drink","Optastar Protein Sdn Bhd is a junior supplier from Kuala Lumpur, Malaysia. They are a manufacturer/oem specializing in beverages, juice and protein drink. Founded in 2019. They are GMP certified.",Acai Berry Fruit Juice Powder; Acerola Cherry Fruit Juice Extract; Acerola Cherry Fruit Juice Powder,Acai Berry Extract & Products; Acerola Cherry Extract & Products,companies,2026-07-20
1445240,Nutrifres Food & Beverages,https://www.go4worldbusiness.com/member/view/1445240/nutrifres-food-beverages.html,Malaysia,Shah Alam,"No.4, 6&8, Jalan Bulan U5/166 Bandar Pinggiran Subang, Seksyen U5 Shah Alam 40150 Selangor Malaysia",https://www.go4worldbusiness.com/member/view/1445240/nutrifres-food-beverages.html,NULL,Wendy Chen,Export Sales Executive,Premium,"December, 2016",NULL,NULL,Nutrifres Food & Beverages,2000,Manufacturer/ OEM,Supplier,NULL,Sells Juices (ready to drinks) and fruits concentrate,"Nutrifres Food & Beverages is a junior supplier from Shah Alam, Malaysia. They are a manufacturer/oem specializing in juices (ready to drinks) and fruits concentrate. Founded in 2000. They are ISO 2200:2005, HACCP and and Halal certiticate certified.",Acai Berry Fruit Juice Powder; Acerola Cherry Fruit Juice Extract; Acerola Cherry Fruit Juice Powder,Acai Berry Extract & Products; Acerola Cherry Extract & Products,companies,2026-07-20
1349266,Gemilang Internatioanl Phils Inc,https://www.go4worldbusiness.com/member/view/1349266/gemilang-internatioanl-phils-inc.html,Malaysia,Pasig,Shaw Blvrd Pasig 1600 Manila Malaysia,https://www.go4worldbusiness.com/member/view/1349266/gemilang-internatioanl-phils-inc.html,NULL,Gee Legaspi,Managing Director,Premium,"August, 2015",NULL,NULL,Gemilang Internatioanl Phils Inc,NULL,Service Provider,Supplier,NULL,Sells Pomegranate juice,"Gemilang Internatioanl Phils Inc is a junior supplier from Pasig, Malaysia. They are a service provider specializing in pomegranate juice.",Acai Berry Fruit Juice Powder; Acerola Cherry Fruit Juice Extract; Acerola Cherry Fruit Juice Powder,Acai Berry Extract & Products; Acerola Cherry Extract & Products,companies,2026-07-20
1432947,Sunshine Food Manufacture Co Sdn Bhd,https://www.go4worldbusiness.com/member/view/1432947/sunshine-food-manufacture-co-sdn-bhd.html,Malaysia,Kuching,NULL,NULL,NULL,NULL,NULL,NULL,NULL,NULL,NULL,NULL,NULL,NULL,NULL,NULL,NULL,NULL,Acai Berry Fruit Juice Powder; Acerola Cherry Fruit Juice Extract; Acerola Cherry Fruit Juice Powder,Acai Berry Extract & Products; Acerola Cherry Extract & Products,companies,2026-07-20
253727,Dynamic Multiway Sdn Bhd,https://www.go4worldbusiness.com/member/view/253727/dynamic-multiway-sdn-bhd.html,Malaysia,Kuching,NULL,NULL,NULL,NULL,NULL,NULL,NULL,NULL,NULL,NULL,NULL,NULL,NULL,NULL,NULL,NULL,Acai Berry Fruit Juice Powder; Acai Berry Fruit Powder; Acerola Cherry Fruit Juice Extract; Acerola Cherry Fruit Juice Powder; Agaricus Blazei Mushroom Fungus Fruiting Body Powder; Agarikon Mushroom Fungus Fruiting Body Powder Polysaccharides; Alfalfa Juice Powder Gluten Free,Acai Berry Extract & Products; Acerola Cherry Extract & Products; Agaricus Extract & Products; Agarikon Extract & Products; Alfalfa Extract & Products,companies,2026-07-20
3010288,Five M Trading (M) Sdn Bhd,https://www.go4worldbusiness.com/member/view/3010288/five-m-trading-%28m%29-sdn-bhd.html,Malaysia,Ipoh,NULL,NULL,NULL,NULL,NULL,NULL,NULL,NULL,NULL,NULL,NULL,NULL,NULL,NULL,NULL,NULL,Acai Berry Fruit Juice Powder; Acerola Cherry Fruit Juice Extract; Acerola Cherry Fruit Juice Powder,Acai Berry Extract & Products; Acerola Cherry Extract & Products,companies,2026-07-20
1535962,Natural Wellness Sdn Bhd,https://www.go4worldbusiness.com/member/view/1535962/natural-wellness-sdn-bhd.html,Malaysia,Pulau Pinang,NULL,NULL,NULL,NULL,NULL,NULL,NULL,NULL,NULL,NULL,NULL,NULL,NULL,NULL,NULL,NULL,Acai Berry Fruit Juice Powder; Acerola Cherry Fruit Juice Extract; Acerola Cherry Fruit Juice Powder,Acai Berry Extract & Products; Acerola Cherry Extract & Products,companies,2026-07-20
217906,Cocosong Food Industries Sdn. Bhd.,https://www.go4worldbusiness.com/member/view/217906/cocosong-food-industries-sdn-bhd-.html,Malaysia,Batu Pahat,NULL,NULL,NULL,NULL,NULL,NULL,NULL,NULL,NULL,NULL,NULL,NULL,NULL,NULL,NULL,NULL,Acai Berry Fruit Juice Powder; Acerola Cherry Fruit Juice Extract; Acerola Cherry Fruit Juice Powder,Acai Berry Extract & Products; Acerola Cherry Extract & Products,companies,2026-07-20
4351296,Fruit Smash,https://www.go4worldbusiness.com/member/view/4351296/fruit-smash.html,Malaysia,Kota Kinabalu,NULL,NULL,NULL,NULL,NULL,NULL,NULL,NULL,NULL,NULL,NULL,NULL,NULL,NULL,NULL,NULL,Acai Berry Fruit Juice Powder; Acai Berry Fruit Powder; Acerola Cherry Fruit Fibre; Acerola Cherry Fruit Juice Extract; Acerola Cherry Fruit Juice Powder,Acai Berry Extract & Products; Acerola Cherry Extract & Products,companies,2026-07-20
1363139,Shirin Asal Sdn Bhd,https://www.go4worldbusiness.com/member/view/1363139/shirin-asal-sdn-bhd.html,Malaysia,Kuala Lumpur,NULL,NULL,NULL,NULL,NULL,NULL,NULL,NULL,NULL,NULL,NULL,NULL,NULL,NULL,NULL,NULL,Acai Berry Fruit Juice Powder; Acerola Cherry Fruit Juice Powder; Alfalfa Juice Powder Gluten Free,Acai Berry Extract & Products; Acerola Cherry Extract & Products; Alfalfa Extract & Products,companies,2026-07-20
