company_id,company_name,company_profile_url,country,city,address,website,phone,contact_person,contact_designation,member_status,member_since,verified,verification_details,legal_entity,established_year,primary_business,role,products_listed_count,deal_focus,description,search_terms,category_types,search_tab,scrape_date
4205396,Ashira Thai Premium Herbs & Supplies,https://www.go4worldbusiness.com/member/view/4205396/ashira-thai-premium-herbs-supplies.html,Thailand,Bangkok,"10 Chan 40/1 Chan Rd. Bangkok, Thailand Bangkok 10120 Thailand",http://www.ashirapremium.com,+66-62-453-9466,Naya,Ceo,Premium,"June, 2024",NULL,NULL,Ashira Thai Premium Herbs & Supplies,2023,Distributor,Supplier,31,"Sells Dried fruits like dried mango, dried pineapple and golden raisin","Ashira Thai Premium Herbs & Supplies is a junior supplier from Bangkok, Thailand. They are a distributor specializing in dried fruits like dried mango, dried pineapple, golden raisin and dried jackfruit. Founded in 2023, they report annual sales of around USD 250,000. They list 31 products.",Acesulfame-K,Acesulfame,suppliers,2026-07-20
283762,"Vaniche Co., Ltd.",https://www.go4worldbusiness.com/member/view/283762/vaniche-co-ltd-.html,Thailand,Chiangmai,"133 Boonraksa Road T. Tasala, Muang Chiangmai 50000 Thailand",https://www.go4worldbusiness.com/member/view/283762/vaniche-co-ltd-.html,NULL,Saipin Vanichmongkol,Marketing Director,Premium,"August, 2005",NULL,NULL,"Vaniche Co., Ltd.",2002,Manufacturer/ OEM,Supplier,5,NULL,"Vaniche Co., Ltd. is a junior supplier from Chiangmai, Thailand. They are a manufacturer/oem specializing in silk cushion cover, silk pillow case, photo frame and silk jewellery box. Founded in 2002, they report annual sales of USD 250,000 to USD 1 million. They list 5 products.",Acesulfame-K,Acesulfame,suppliers,2026-07-20
3240427,Pro Tooling & Technology Company Limited,https://www.go4worldbusiness.com/member/view/3240427/pro-tooling-technology-company-limited.html,Thailand,Chonburi,112/1 Moo. 3 Donhuaroh Subdistrict Muang Chonburi District Chonburi 20000 Thailand,https://www.go4worldbusiness.com/member/view/3240427/pro-tooling-technology-company-limited.html,NULL,Kitti Onniam,Managing Director,Premium,"March, 2021",yes,Company Registration Certificate Verified,Pro Tooling & Technology Company Limited,2013,Dealer / Reseller,Supplier,1,"Sells Nitrile examination gloves, nitrile disposable glove and latex gloves","Pro Tooling & Technology Company Limited is a junior supplier from Chonburi, Thailand. They are a dealer/reseller specializing in nitrile examination gloves, nitrile disposable glove and latex gloves. Founded in 2013. They list 1 product.",Acesulfame-K,Acesulfame,suppliers,2026-07-20
1716037,"Kasetnumchok Co., Ltd.",https://www.go4worldbusiness.com/member/view/1716037/kasetnumchok-co-ltd-.html,Thailand,Bangkorlaem,"214 Rama 3 Road, Bangkorlaem Bangkorlaem 10120 Bangkok Thailand",http://www.kasetnumchok.com,+66-2-689-2420,Kittisak Pakasiri,Manager,Premium,"March, 2019",NULL,NULL,"Kasetnumchok Co., Ltd.",2003,Manufacturer/ OEM,Supplier,9,"Sells Organic silicon rich fertilizer, silicon minerals and organic fungicides","Kasetnumchok Co., Ltd. is a junior supplier from Bangkorlaem, Thailand. They are a manufacturer/oem specializing in organic silicon rich fertilizer, silicon minerals, organic fungicides and organic insecticides. Founded in 2003, they report annual sales of USD 1 million to USD 5 million. They list 9 products.",Acesulfame-K,Acesulfame,suppliers,2026-07-20
3014667,Eec Technology Trading Group,https://www.go4worldbusiness.com/member/view/3014667/eec-technology-trading-group.html,Thailand,Bangkok,"Town In Town, Soi 3/3, (No. 1439), Siwara Road, Phlapphla Subdistrict, Wang Thonglang District Bangkok 10310 Wangthonglang Thailand",https://www.go4worldbusiness.com/member/view/3014667/eec-technology-trading-group.html,NULL,Weddy,Sales And Translator,Premium,"August, 2020",yes,Company Registration Certificate Verified,Eec Technology Trading Group,2020,Dealer / Reseller,Supplier,5,"Sells Nitrile, powder free and medical examination gloves","Eec Technology Trading Group is a junior supplier from Bangkok, Thailand. They are a dealer/reseller specializing in nitrile, powder free, medical examination gloves and latex. Founded in 2020, they report annual sales of USD 250,000 to USD 1 million. They list 5 products.",Acesulfame-K,Acesulfame,suppliers,2026-07-20
1349683,Suwancham Dairy Ltd,https://www.go4worldbusiness.com/member/view/1349683/suwancham-dairy-ltd.html,Thailand,Chainag Mai,"Ratvithi Rd, Tambon Si Phum, Amphoe Muea Ratvithi Rd, Tambon Si Phum, Amphoe Muea Chainag Mai 47000 Chaing Mai Thailand",https://www.go4worldbusiness.com/member/view/1349683/suwancham-dairy-ltd.html,NULL,Leemoa,Ceo,Premium,"August, 2015",NULL,NULL,Suwancham Dairy Ltd,2006,"Manufacturer/ OEM, Distributor, Dealer / Reseller",Buyer and Supplier,16,"Sells Corn, beans and rice | Buys Corn, beans and rice","Suwancham Dairy Ltd is a junior buyer and supplier from Chainag Mai, Thailand. They are a manufacturer/oem, distributor, dealer/reseller specializing in corn, beans, rice and sugar. They are a manufacturer/oem, distributor, dealer/reseller for corn, beans, rice and sugar. Founded in 2006, they report annual sales of USD 50 million to USD 100 million. They list 16 products.",Acesulfame-K; Adipic Acid,Acesulfame; Adipic Acid,suppliers,2026-07-20
4080965,K And K,https://www.go4worldbusiness.com/member/view/4080965/k-and-k.html,Thailand,NULL,- - Thailand,https://www.go4worldbusiness.com/member/view/4080965/k-and-k.html,NULL,Michel Phone: Not displayed by user.,NULL,Premium,"January, 2024",NULL,NULL,K And K,2024,NULL,Supplier,NULL,Sells Fresh jasmine flowers,K And K is a junior supplier from Thailand. They supply fresh jasmine flowers. Founded in 2024.,Acesulfame-K,Acesulfame,suppliers,2026-07-20
2791416,K-nergy,https://www.go4worldbusiness.com/member/view/2791416/k-nergy.html,Thailand,Bangkok,"Muntana Lake Watcharaphol Village, Home No.299/530 , Sukhapiban 5 Rd., Saimai, Saimai, Thailand, 102 Bangkok 10220 Bangkok Thailand",https://www.go4worldbusiness.com/member/view/2791416/k-nergy.html,NULL,Soravit Chinnapan,General Manager,Premium,"January, 2020",NULL,NULL,K-nergy,2019,Dealer / Reseller,Supplier,3,"Sells Dried fruit, coconut oil and jasmine rice","K-nergy is a junior supplier from Bangkok, Thailand. They are a dealer/reseller specializing in dried fruit, coconut oil and jasmine rice. Founded in 2019. They list 3 products.",Acesulfame-K,Acesulfame,suppliers,2026-07-20
3328995,"Agra-Tools Co., Ltd",https://www.go4worldbusiness.com/member/view/3328995/agra-tools-co-ltd.html,Thailand,Wangthonglang,"3882 Ladprao Road, Kwangwangthonglang, Wangthonglang, Bangkok, Thailand Wangthonglang 10310 Bangkok Thailand",http://www.agra-tools.com,NULL,Natasha Lee,Marketing Manager,Premium,"June, 2021",NULL,NULL,"Agra-Tools Co., Ltd",2013,Distributor,Supplier,15,"Sells Farm and acreage, air tools and compressors and lawn and garden","Agra-Tools Co., Ltd is a junior supplier from Wangthonglang, Thailand. They are a distributor specializing in farm and acreage, air tools and compressors, lawn and garden and pressure washers. Founded in 2013, they report annual sales of USD 25 million to USD 50 million. They list 15 products.",Acesulfame-K,Acesulfame,suppliers,2026-07-20
1231202,"Continental Biomass Energy Co., Ltd.",https://www.go4worldbusiness.com/member/view/1231202/continental-biomass-energy-co-ltd-.html,Thailand,Bangkok,448/248 Subkaew Tower Pracharutih 6 Huaykwang Bangkok 10310 Thailand,https://www.go4worldbusiness.com/member/view/1231202/continental-biomass-energy-co-ltd-.html,NULL,Thongsuk Ketsawang,Marketing Manager,Premium,"February, 2014",NULL,NULL,"Continental Biomass Energy Co., Ltd.",NULL,Manufacturer/ OEM,Supplier,2,NULL,"Continental Biomass Energy Co., Ltd. is a junior supplier from Bangkok, Thailand. They are a manufacturer/oem specializing in organic fertilize npk and palm acid oil. They report annual sales of USD 1 million to USD 5 million. They are ISO 2002 certified. They list 2 products.",Acesulfame-K; Adipic Acid,Acesulfame; Adipic Acid,suppliers,2026-07-20
3523495,kittan k,https://www.go4worldbusiness.com/member/view/3523495/kittan-k.html,Thailand,NULL,- - Thailand,https://www.go4worldbusiness.com/member/view/3523495/kittan-k.html,NULL,Kittas Phone: Not displayed by user.,NULL,Premium,"January, 2022",NULL,NULL,kittan k,2022,NULL,Supplier,NULL,Sells : batteries,kittan k is a junior supplier from Thailand. They supply : batteries. Founded in 2022.,Acesulfame-K,Acesulfame,suppliers,2026-07-20
3096382,Pariyakorn K,https://www.go4worldbusiness.com/member/view/3096382/pariyakorn-k.html,Thailand,Bangkok,Bangkok Bangkok 10400 Thailand,https://www.go4worldbusiness.com/member/view/3096382/pariyakorn-k.html,NULL,Pariyakorn K,NULL,Premium,"October, 2020",NULL,NULL,Pariyakorn K,2019,Buying Agent,Buyer and Supplier,NULL,Sells Nitrile gloves | Buys Nitrile gloves,"Pariyakorn K is a junior buyer and supplier from Bangkok, Thailand. They are a buying agent specializing in nitrile gloves. They are a buying agent for nitrile gloves. Founded in 2019. They are ISO10993 certified.",Acesulfame-K,Acesulfame,suppliers,2026-07-20
3456199,K Square,https://www.go4worldbusiness.com/member/view/3456199/k-square.html,Thailand,Laksi,- Laksi 10210 Bangkok Thailand,https://www.go4worldbusiness.com/member/view/3456199/k-square.html,NULL,Lal,Director,Premium,"October, 2021",NULL,NULL,K Square,2020,NULL,Supplier,NULL,"Sells Coffee beans, green coffee beans and roasted coffee beans","K Square is a junior supplier from Laksi, Thailand. They supply coffee beans, green coffee beans, roasted coffee beans and organic coffee. Founded in 2020.",Acesulfame-K,Acesulfame,suppliers,2026-07-20
3304600,"Orbits Dvl Co., Ltd.",https://www.go4worldbusiness.com/member/view/3304600/orbits-dvl-co-ltd-.html,Thailand,Bangkok,"259/243-244 Floor 2, Roge Building Preedeepanomyong Road, Prakanong-nua, Vadhana, Bangkok 10400 Thailand Bangkok 10400 Thailand",http://www.orbitsdvl.co.th,NULL,Ratta T.,Sales Manager,Premium,"May, 2021",yes,Company Registration Certificate Verified,"Orbits Dvl Co., Ltd.",2015,Distributor,Supplier,2,"Sells Nitrile gloves, eco friendly cutlery and green cutlery","Orbits Dvl Co., Ltd. is a junior supplier from Bangkok, Thailand. They are a distributor specializing in nitrile gloves, eco friendly cutlery and green cutlery. Founded in 2015, they report annual sales of USD 250,000 to USD 1 million. They list 2 products.",Acesulfame-K,Acesulfame,suppliers,2026-07-20
4400684,Mohit K,https://www.go4worldbusiness.com/member/view/4400684/mohit-k.html,Thailand,NULL,-Thailand. - Thailand,https://www.go4worldbusiness.com/member/view/4400684/mohit-k.html,NULL,Mohit K Phone: Not displayed by user.,NULL,Premium,"April, 2025",NULL,NULL,Mohit K,2025,NULL,Supplier,NULL,Sells Yarn.,Mohit K is a junior supplier from Thailand. They supply yarn.s. Founded in 2025.,Acesulfame-K,Acesulfame,suppliers,2026-07-20
1446399,"Bornnet Corporation Co., Ltd.",https://www.go4worldbusiness.com/member/view/1446399/bornnet-corporation-co-ltd-.html,Thailand,Minburi,91 /41-42 Suwinthawong Road Minburi 10510 Bangkok Thailand,https://www.go4worldbusiness.com/member/view/1446399/bornnet-corporation-co-ltd-.html,NULL,Supattra Jugkaew,Sales Representative,Premium,"December, 2016",NULL,NULL,"Bornnet Corporation Co., Ltd.",20,Manufacturer/ OEM,Supplier,4,Sells Sugar,"Bornnet Corporation Co., Ltd. is a junior supplier from Minburi, Thailand. They are a manufacturer/oem specializing in sugars. Founded in 20, they report annual sales of USD 250,000 to USD 1 million. They list 4 products.",Acesulfame-K,Acesulfame,suppliers,2026-07-20
615433,Rwa International,https://www.go4worldbusiness.com/member/view/615433/rwa-international.html,Thailand,Nontahburi,Taringcgan Nontahburi 11130 Bangyai Thailand,https://www.go4worldbusiness.com/member/view/615433/rwa-international.html,NULL,Ruchapolmp,Marketing,Premium,"April, 2008",NULL,NULL,Rwa International,NULL,Distributor,Supplier,2,"Sells Manganese ore, bat guano oganic fertilizer and iron","Rwa International is a junior supplier from Nontahburi, Thailand. They are a distributor specializing in manganese ore, bat guano oganic fertilizer and iron. They list 2 products.",Acesulfame-K,Acesulfame,suppliers,2026-07-20
358266,Alfa K Ltd,https://www.go4worldbusiness.com/member/view/358266/alfa-k-ltd.html,Thailand,Bangkae,99/21moo 4 Bangkae Nua Bangkae 10160 Bangkok Thailand,https://www.go4worldbusiness.com/member/view/358266/alfa-k-ltd.html,NULL,Karoon Nim,Manager,Premium,"January, 2006",NULL,NULL,Alfa K Ltd,1997,Dealer / Reseller,Supplier and Service Provider,NULL,Sells Ladies dresses | Services Tailor service for any quantity high grade dress,"Alfa K Ltd is a junior supplier and service provider from Bangkae, Thailand. They are a dealer/reseller specializing in ladies dresses. They provide services such as tailor service for any quantity high grade dress. Founded in 1997, they report annual sales of around USD 250,000.",Acesulfame-K,Acesulfame,suppliers,2026-07-20
194798,K-Max Ltd,https://www.go4worldbusiness.com/member/view/194798/k-max-ltd.html,Thailand,Muang,"12/3 Moo.4 , T.bangkung Muang 84000 Suratthani Thailand",https://www.go4worldbusiness.com/member/view/194798/k-max-ltd.html,NULL,Phakamas Yoddontri,Export Director,Premium,"November, 2004",NULL,NULL,K-Max Ltd,2004,Service Provider,Buyer and Supplier,NULL,Sells Fresh durian and mangosteen | Buys Live lobster seed,"K-Max Ltd is a junior buyer and supplier from Muang, Thailand. They are a service provider specializing in fresh durian and mangosteen. They are a service provider for live lobster seed. Founded in 2004.",Acesulfame-K,Acesulfame,suppliers,2026-07-20
110039,C. K. Frozen,https://www.go4worldbusiness.com/member/view/110039/c-k-frozen.html,Thailand,Bangkok,P.o.box 30 Bungkum Post Office Bangkok 10240 Thailand,https://www.go4worldbusiness.com/member/view/110039/c-k-frozen.html,NULL,Mohd. Ali,Director,Premium,"September, 2003",NULL,NULL,C. K. Frozen,NULL,Buying Agent,Buyer and Supplier,NULL,Sells Frozen fresh water fish and sea fish | Buys Red lentil and frozen chicken and frozen halal meat,"C. K. Frozen is a junior buyer and supplier from Bangkok, Thailand. They are a buying agent specializing in frozen fresh water fish and sea fish. They are a buying agent for red lentil and frozen chicken and frozen halal meat. They report annual sales of USD 15 million to USD 25 million. They are ISO9002 certified.",Acesulfame-K,Acesulfame,suppliers,2026-07-20
156619,K. S. Stones,https://www.go4worldbusiness.com/member/view/156619/k-s-stones.html,Thailand,Bangkok,"109, Soi Puttha Osoth, New Road 45 Bangrak Bangkok 10500 Thailand",https://www.go4worldbusiness.com/member/view/156619/k-s-stones.html,NULL,Raj Kumar Jain,Director,Premium,"May, 2004",NULL,NULL,K. S. Stones,1998,Manufacturer/ OEM,Supplier,NULL,Sells Precious and semi precious gemstones,"K. S. Stones is a junior supplier from Bangkok, Thailand. They are a manufacturer/oem specializing in precious and semi precious gemstones. Founded in 1998, they report annual sales of USD 5 million to USD 15 million.",Acesulfame-K,Acesulfame,suppliers,2026-07-20
2828571,F&k Beautyshop,https://www.go4worldbusiness.com/member/view/2828571/f-k-beautyshop.html,Thailand,Chiang Mai,Tonpao Sankampaeng Chiang Mai 50130 Thailand,https://www.go4worldbusiness.com/member/view/2828571/f-k-beautyshop.html,NULL,Kanokwan Dogac,Sales Director,Premium,"March, 2020",NULL,NULL,F&k Beautyshop,NULL,Distributor,"Buyer, Supplier and Service Provider",NULL,Sells Medical face mask | Buys Medical face mask | Services Import & export,"F&k Beautyshop is a junior buyer, supplier and service provider from Chiang Mai, Thailand. They are a distributor specializing in medical face mask. They are a distributor for medical face mask. They provide services such as import & export.",Acesulfame-K,Acesulfame,suppliers,2026-07-20
4093666,K Nature Health,https://www.go4worldbusiness.com/member/view/4093666/k-nature-health.html,Thailand,Bangkok,786 Ladya Klongsan Bangkok 10600 Thailand,https://www.go4worldbusiness.com/member/view/4093666/k-nature-health.html,NULL,Pimras,Sale Manager,Premium,"January, 2024",NULL,NULL,K Nature Health,2016,Distributor,Supplier,NULL,Sells Hair product hair treatment shampoo hair tonic,"K Nature Health is a junior supplier from Bangkok, Thailand. They are a distributor specializing in hair product hair treatment shampoo hair tonic. Founded in 2016.",Acesulfame-K,Acesulfame,suppliers,2026-07-20
4093694,K Natural Health,https://www.go4worldbusiness.com/member/view/4093694/k-natural-health.html,Thailand,NULL,- - Thailand,https://www.go4worldbusiness.com/member/view/4093694/k-natural-health.html,NULL,Pimras Phone: Not displayed by user.,NULL,Premium,"January, 2024",NULL,NULL,K Natural Health,2023,NULL,Supplier,NULL,Sells Keratin products,K Natural Health is a junior supplier from Thailand. They supply keratin products. Founded in 2023.,Acesulfame-K,Acesulfame,suppliers,2026-07-20
3991930,Alfa K Ltd.,https://www.go4worldbusiness.com/member/view/3991930/alfa-k-ltd-.html,Thailand,Bangkok,-88/21 Buddamonthon Sai2 Bangkok 10160 Thailand,https://www.go4worldbusiness.com/member/view/3991930/alfa-k-ltd-.html,NULL,Karoon,Gm,Premium,"September, 2023",NULL,NULL,Alfa K Ltd.,2010,Service Provider,Supplier and Service Provider,NULL,Sells Ladies' T Shirts | Services Trading and Import and Export,"Alfa K Ltd. is a junior supplier and service provider from Bangkok, Thailand. They are a service provider specializing in ladies' t shirts. They provide services such as trading and import and export. Founded in 2010.",Acesulfame-K,Acesulfame,suppliers,2026-07-20
1499674,Q&K Fashion,https://www.go4worldbusiness.com/member/view/1499674/q-k-fashion.html,Thailand,Bangkok,NULL,NULL,NULL,NULL,NULL,NULL,NULL,NULL,NULL,NULL,NULL,NULL,NULL,NULL,NULL,NULL,Acesulfame-K,Acesulfame,suppliers,2026-07-20
363696,"N & K Orchid Farms, Co., Ltd.",https://www.go4worldbusiness.com/member/view/363696/n-k-orchid-farms-co-ltd-.html,Thailand,Bangkhae,NULL,NULL,NULL,NULL,NULL,NULL,NULL,NULL,NULL,NULL,NULL,NULL,NULL,NULL,NULL,NULL,Acesulfame-K,Acesulfame,suppliers,2026-07-20
4448818,K&p Farm,https://www.go4worldbusiness.com/member/view/4448818/k-p-farm.html,Thailand,NULL,NULL,NULL,NULL,NULL,NULL,NULL,NULL,NULL,NULL,NULL,NULL,NULL,NULL,NULL,NULL,NULL,Acesulfame-K,Acesulfame,suppliers,2026-07-20
1562428,N K Intrernationally,https://www.go4worldbusiness.com/member/view/1562428/n-k-intrernationally.html,Thailand,Bangkok,NULL,NULL,NULL,NULL,NULL,NULL,NULL,NULL,NULL,NULL,NULL,NULL,NULL,NULL,NULL,NULL,Acesulfame-K,Acesulfame,suppliers,2026-07-20
4491102,S K Farm,https://www.go4worldbusiness.com/member/view/4491102/s-k-farm.html,Thailand,NULL,NULL,NULL,NULL,NULL,NULL,NULL,NULL,NULL,NULL,NULL,NULL,NULL,NULL,NULL,NULL,NULL,Acesulfame-K,Acesulfame,suppliers,2026-07-20
2868013,Winsor Transaction Company,https://www.go4worldbusiness.com/member/view/2868013/winsor-transaction-company.html,Thailand,Bangkok,NULL,NULL,NULL,NULL,NULL,NULL,NULL,NULL,NULL,NULL,NULL,NULL,NULL,NULL,NULL,NULL,Acesulfame-K,Acesulfame,suppliers,2026-07-20
1349188,Taveesapanan Food Product,https://www.go4worldbusiness.com/member/view/1349188/taveesapanan-food-product.html,Thailand,Muang,NULL,NULL,NULL,NULL,NULL,Premium,NULL,NULL,NULL,NULL,NULL,NULL,NULL,NULL,NULL,NULL,Acesulfame-K; Agaricus Blazei Murill Mushroom Fungus Fruiting Body Extract,Acesulfame; Agaricus Extract & Products,suppliers,2026-07-20
1616068,"P&k Enterprise (thailand) Co., Ltd.",https://www.go4worldbusiness.com/member/view/1616068/p-k-enterprise-%28thailand%29-co-ltd-.html,Thailand,Nakornpathom,NULL,NULL,NULL,NULL,NULL,NULL,NULL,NULL,NULL,NULL,NULL,NULL,NULL,NULL,NULL,NULL,Acesulfame-K,Acesulfame,suppliers,2026-07-20
1600321,J. K. Y Trader Co. Ltd.,https://www.go4worldbusiness.com/member/view/1600321/j-k-y-trader-co-ltd-.html,Thailand,Bangkok,NULL,NULL,NULL,NULL,NULL,NULL,NULL,NULL,NULL,NULL,NULL,NULL,NULL,NULL,NULL,NULL,Acesulfame-K,Acesulfame,suppliers,2026-07-20
1262477,"Pt. Part And Machine Co., Ltd.",https://www.go4worldbusiness.com/member/view/1262477/pt-part-and-machine-co-ltd-.html,Thailand,Samutprakarn,NULL,NULL,NULL,NULL,NULL,NULL,NULL,NULL,NULL,NULL,NULL,NULL,NULL,NULL,NULL,NULL,Acesulfame-K,Acesulfame,suppliers,2026-07-20
805148,K-tech.Centre Co;ltd,https://www.go4worldbusiness.com/member/view/805148/k-tech-centre-co;ltd.html,Thailand,Phatumtanee,NULL,NULL,NULL,NULL,NULL,NULL,NULL,NULL,NULL,NULL,NULL,NULL,NULL,NULL,NULL,NULL,Acesulfame-K,Acesulfame,suppliers,2026-07-20
1039108,N K Creativity Center,https://www.go4worldbusiness.com/member/view/1039108/n-k-creativity-center.html,Thailand,Sapansoong,NULL,NULL,NULL,NULL,NULL,NULL,NULL,NULL,NULL,NULL,NULL,NULL,NULL,NULL,NULL,NULL,Acesulfame-K,Acesulfame,suppliers,2026-07-20
1221848,K W Maritime Inspection,https://www.go4worldbusiness.com/member/view/1221848/k-w-maritime-inspection.html,Thailand,Singburi,NULL,NULL,NULL,NULL,NULL,NULL,NULL,NULL,NULL,NULL,NULL,NULL,NULL,NULL,NULL,NULL,Acesulfame-K,Acesulfame,suppliers,2026-07-20
2772839,L K Y S,https://www.go4worldbusiness.com/member/view/2772839/l-k-y-s.html,Thailand,NULL,NULL,NULL,NULL,NULL,NULL,NULL,NULL,NULL,NULL,NULL,NULL,NULL,NULL,NULL,NULL,NULL,Acesulfame-K,Acesulfame,suppliers,2026-07-20
4133671,K M Green Co.ltd,https://www.go4worldbusiness.com/member/view/4133671/k-m-green-co-ltd.html,Thailand,Bangkok-,NULL,NULL,NULL,NULL,NULL,NULL,NULL,NULL,NULL,NULL,NULL,NULL,NULL,NULL,NULL,NULL,Acesulfame-K,Acesulfame,suppliers,2026-07-20
4093830,K Nature Health Company,https://www.go4worldbusiness.com/member/view/4093830/k-nature-health-company.html,Thailand,NULL,NULL,NULL,NULL,NULL,NULL,NULL,NULL,NULL,NULL,NULL,NULL,NULL,NULL,NULL,NULL,NULL,Acesulfame-K,Acesulfame,companies,2026-07-20
4022933,T&k Bangkok Foods,https://www.go4worldbusiness.com/member/view/4022933/t-k-bangkok-foods.html,Thailand,Pakkret,NULL,NULL,NULL,NULL,NULL,NULL,NULL,NULL,NULL,NULL,NULL,NULL,NULL,NULL,NULL,NULL,Acesulfame-K,Acesulfame,companies,2026-07-20
456517,"K R Prosperity Co., Ltd.",https://www.go4worldbusiness.com/member/view/456517/k-r-prosperity-co-ltd-.html,Thailand,Bangkok,NULL,NULL,NULL,NULL,NULL,NULL,NULL,NULL,NULL,NULL,NULL,NULL,NULL,NULL,NULL,NULL,Acesulfame-K,Acesulfame,companies,2026-07-20
639058,H&K Trading Company Ltd,https://www.go4worldbusiness.com/member/view/639058/h-k-trading-company-ltd.html,Thailand,Bangkok,NULL,NULL,NULL,NULL,NULL,NULL,NULL,NULL,NULL,NULL,NULL,NULL,NULL,NULL,NULL,NULL,Acesulfame-K,Acesulfame,companies,2026-07-20
1271939,"K-Tech Centre Co., Ltd.",https://www.go4worldbusiness.com/member/view/1271939/k-tech-centre-co-ltd-.html,Thailand,Klonglaung,NULL,NULL,NULL,NULL,NULL,NULL,NULL,NULL,NULL,NULL,NULL,NULL,NULL,NULL,NULL,NULL,Acesulfame-K,Acesulfame,companies,2026-07-20
3199746,K S International Management Co. Ltd.,https://www.go4worldbusiness.com/member/view/3199746/k-s-international-management-co-ltd-.html,Thailand,Bangkok,NULL,NULL,NULL,NULL,NULL,NULL,NULL,NULL,NULL,NULL,NULL,NULL,NULL,NULL,NULL,NULL,Acesulfame-K,Acesulfame,companies,2026-07-20
3156246,K. S. International Management Co. Ltd.,https://www.go4worldbusiness.com/member/view/3156246/k-s-international-management-co-ltd-.html,Thailand,Bueng Kum,NULL,NULL,NULL,NULL,NULL,NULL,NULL,NULL,NULL,NULL,NULL,NULL,NULL,NULL,NULL,NULL,Acesulfame-K,Acesulfame,companies,2026-07-20
465037,"J-K Impex (Thailand) Co., Ltd.",https://www.go4worldbusiness.com/member/view/465037/j-k-impex-%28thailand%29-co-ltd-.html,Thailand,Bangkok,NULL,NULL,NULL,NULL,NULL,NULL,NULL,NULL,NULL,NULL,NULL,NULL,NULL,NULL,NULL,NULL,Acesulfame-K,Acesulfame,companies,2026-07-20
676595,"T. S. K. Holding Co., Ltd.",https://www.go4worldbusiness.com/member/view/676595/t-s-k-holding-co-ltd-.html,Thailand,Samutprakarn,NULL,NULL,NULL,NULL,NULL,NULL,NULL,NULL,NULL,NULL,NULL,NULL,NULL,NULL,NULL,NULL,Acesulfame-K,Acesulfame,companies,2026-07-20
3667842,K. D. International Group. Co. Ltd,https://www.go4worldbusiness.com/member/view/3667842/k-d-international-group-co-ltd.html,Thailand,Bangkok,NULL,NULL,NULL,NULL,NULL,NULL,NULL,NULL,NULL,NULL,NULL,NULL,NULL,NULL,NULL,NULL,Acesulfame-K,Acesulfame,companies,2026-07-20
4595254,T P K Lumber Co. Ltd.,https://www.go4worldbusiness.com/member/view/4595254/t-p-k-lumber-co-ltd-.html,Thailand,NULL,NULL,NULL,NULL,NULL,NULL,NULL,NULL,NULL,NULL,NULL,NULL,NULL,NULL,NULL,NULL,NULL,Acesulfame-K,Acesulfame,companies,2026-07-20
4566250,K V N Import & Export 1991 Co. Ltd.,https://www.go4worldbusiness.com/member/view/4566250/k-v-n-import-export-1991-co-ltd-.html,Thailand,NULL,NULL,NULL,NULL,NULL,NULL,NULL,NULL,NULL,NULL,NULL,NULL,NULL,NULL,NULL,NULL,NULL,Acesulfame-K,Acesulfame,companies,2026-07-20
4238439,"Aurora Industry Co., Ltd.",https://www.go4worldbusiness.com/member/view/4238439/aurora-industry-co-ltd-.html,Thailand,Dalian,NULL,NULL,NULL,NULL,NULL,NULL,NULL,yes,NULL,NULL,NULL,NULL,NULL,NULL,NULL,NULL,Acesulfame-K; Agar Agar,Acesulfame; Agar Agar,companies,2026-07-20
4120310,IBT Agro Tarim Ithalat Ihracat Sanayi Ve Ticaret Limited Sirketi,https://www.go4worldbusiness.com/member/view/4120310/ibt-agro-tarim-ithalat-ihracat-sanayi-ve-ticaret-limited-sirketi.html,Thailand,Antalya,NULL,NULL,NULL,NULL,NULL,GOLD,NULL,yes,NULL,NULL,NULL,NULL,NULL,NULL,NULL,NULL,Acesulfame-K,Acesulfame,companies,2026-07-20
4314713,M Trading,https://www.go4worldbusiness.com/member/view/4314713/m-trading.html,Thailand,North York,NULL,NULL,NULL,NULL,NULL,NULL,NULL,NULL,NULL,NULL,NULL,NULL,NULL,NULL,NULL,NULL,Acesulfame-K; Adipic Acid; Agar Agar,Acesulfame; Adipic Acid; Agar Agar,companies,2026-07-20
3625409,Dinayen Enterprise Management,https://www.go4worldbusiness.com/member/view/3625409/dinayen-enterprise-management.html,Thailand,Nanjing,NULL,NULL,NULL,NULL,NULL,NULL,NULL,yes,NULL,NULL,NULL,NULL,NULL,NULL,NULL,NULL,Acesulfame-K; Agar Agar,Acesulfame; Agar Agar,companies,2026-07-20
