company_id,company_name,company_profile_url,country,city,address,website,phone,contact_person,contact_designation,member_status,member_since,verified,verification_details,legal_entity,established_year,primary_business,role,products_listed_count,deal_focus,description,search_terms,category_types,search_tab,scrape_date
2927241,"Thai Foods Product International Co.,ltd",https://www.go4worldbusiness.com/member/view/2927241/thai-foods-product-international-co-ltd.html,Thailand,Minburi,91/38-39 Suwinthawong Rd. Minburi 10510 Bangkok Thailand,https://www.go4worldbusiness.com/member/view/2927241/thai-foods-product-international-co-ltd.html,NULL,Pratoom Puttra,Export Manager,Premium,"May, 2020",NULL,NULL,"Thai Foods Product International Co.,ltd",2000,Manufacturer/ OEM,Supplier,37,Sells 1. food ingredient and food additive 1.1 non dairy creamer 1.2 coconut milk powder 1.3 condensed milk powder 1.4 dried mango 1.5 monosodium glutamate 1.6 ribonucleotide i+g 1.7 fructose syrup 1.8 non phosphate (food grade) 1.9 blended phosphate (food grade) 1.10 durian powder 1.11 white sugar replacer 1.12 fresh milk powder 1.13 instant mixed fruit punch powder 2. dairy products 2.1 childrenÃ??Ã?Â¢??s milk powder 2.2 instant cocoa malt powder beverage 2.3 whipping cream powder 3. 3.1 curcumin capsules 3.2 diabetic control tea 3.3 mushroom 4.beauty product 4.1 acne clearing and whitening gel,"Thai Foods Product International Co.,ltd is a junior supplier from Minburi, Thailand. They are a manufacturer/oem specializing in 1. food ingredient and food additive 1.1 non dairy creamer 1.2 coconut milk powder 1.3 condensed milk powder 1.4 dried mango 1.5 monosodium glutamate 1.6 ribonucleotide i+g 1.7 fructose syrup 1.8 non phosphate (food grade) 1.9 blended phosphate (food grade) 1.10 durian powder 1.11 white...",ATP Adenosine Triphosphate Disodium,ATP,suppliers,2026-07-20
3490565,Goodganic Thailand,https://www.go4worldbusiness.com/member/view/3490565/goodganic-thailand.html,Thailand,Bangbo,"363/1 Moo1 Bangbo Subdistrict, Bangbo Distriict, Samut Prakan 10560 Thailand Bangbo 10560 Samutprakan Thailand",http://www.goodganicthailand.com,NULL,Tammasorn Jiwarangsan,Ceo,Premium,"December, 2021",yes,Company Registration Certificate Verified,Goodganic Thailand,2015,Manufacturer/ OEM,Supplier,29,NULL,"Goodganic Thailand is a junior supplier from Bangbo, Thailand. They are a manufacturer/oem specializing in facial cream, body lotion, sunscreen and herbal toothpaste. and also we produce herbal natural extracts. Founded in 2015, they report annual sales of USD 1 million to USD 5 million. They are GMP, ISO and CFS certificates certified. They list 29 products.",ATP Adenosine Triphosphate Disodium; Gum Acacia Soluble Fibre; Acai Berry Fruit Extract; Acai Berry Fruit Juice Powder; Acerola Cherry Fruit Fibre; Acerola Cherry Fruit Juice Powder; Adipic Acid,ATP; Acacia Fiber; Acai Berry Extract & Products; Acerola Cherry Extract & Products; Adipic Acid,suppliers,2026-07-20
3355168,Vicenta (thailand) Company Limited,https://www.go4worldbusiness.com/member/view/3355168/vicenta-%28thailand%29-company-limited.html,Thailand,Ranong,"109/98 M.1 Saphanpla Rd., Muang, Ranong, 85000 Thailand Ranong 85000 Thailand",http://www.vicenta.co.th,NULL,Sorrawee Phak.,Managing Director,Premium,"July, 2021",yes,Company Registration Certificate Verified,Vicenta (thailand) Company Limited,2018,Distributor,Supplier and Service Provider,65,"Sells Cocoa drink, rubinite energy drink and agar wood soap | Services Trader, distributor and wholesaler","Vicenta (thailand) Company Limited is a junior supplier and service provider from Ranong, Thailand. They are a distributor specializing in cocoa drink, rubinite energy drink, agar wood soap and honey shower gel. They provide services such as trader, distributor and wholesaler. Founded in 2018, they report annual sales of around USD 250,000. They list 65 products.",ATP Adenosine Triphosphate Disodium; Acai Berry Fruit Extract; Acai Berry Fruit Powder; Acerola Cherry Fruit Fibre; Acerola Cherry Fruit Juice Extract; Acerola Cherry Fruit Juice Powder; Adipic Acid; Agar Agar,ATP; Acai Berry Extract & Products; Acerola Cherry Extract & Products; Adipic Acid; Agar Agar,suppliers,2026-07-20
1404798,"Atp Global Service Co., Ltd.",https://www.go4worldbusiness.com/member/view/1404798/atp-global-service-co-ltd-.html,Thailand,Bangkok,"109/13 Chareon Krung 65, Yannawa, Sathor Bangkok 10120 Thailand",https://www.go4worldbusiness.com/member/view/1404798/atp-global-service-co-ltd-.html,NULL,Champ T,Project Development,Premium,"May, 2016",NULL,NULL,"Atp Global Service Co., Ltd.",NULL,Dealer / Reseller,Supplier and Service Provider,NULL,"Sells Wood pellets, wood chips and tapioca chip | Services Logistic services","Atp Global Service Co., Ltd. is a junior supplier and service provider from Bangkok, Thailand. They are a dealer/reseller specializing in wood pellets, wood chips, tapioca chip and agriculture products. They provide services such as logistic services. They report annual sales of USD 5 million to USD 15 million.",ATP Adenosine Triphosphate Disodium,ATP,suppliers,2026-07-20
1854677,Vyntheda,https://www.go4worldbusiness.com/member/view/1854677/vyntheda.html,Thailand,Chumphon,"32/4 Moo7 Bangluek Mueng Chumphon Thailand, 86000 Chumphon 86000 Mueng Thailand",https://www.go4worldbusiness.com/member/view/1854677/vyntheda.html,NULL,Wiparat Ponsab,Owner,Premium,"August, 2019",NULL,NULL,Vyntheda,7,Manufacturer/ OEM,Supplier,5,NULL,"Vyntheda is a junior supplier from Chumphon, Thailand. They are a manufacturer/oem specializing in tamarind scrub soap, natural product skin care, rice scrub and star fruit salt scrub. Founded in 7, they report annual sales of around USD 250,000. They are BSI 9002 and Organic Certificated certified. They list 5 products.",ATP Adenosine Triphosphate Disodium,ATP,suppliers,2026-07-20
3312996,Jumbo Trading Company Limited,https://www.go4worldbusiness.com/member/view/3312996/jumbo-trading-company-limited.html,Thailand,Bangkok,"4388/1 Soi Farmwattana, Rama 4 Road Bangkok 10110 Krung Thep Maha Nakhon Thailand",http://www.jumbo-th.com,NULL,Dr. Sagid,Director,Premium,"May, 2021",yes,NULL,Jumbo Trading Company Limited,1996,Manufacturer/ OEM,Supplier,31,NULL,"Jumbo Trading Company Limited is a junior supplier from Bangkok, Thailand. They are a manufacturer/oem specializing in gum arabic, raw cotton, white sesame and peanuts seeds. Founded in 1996, they report annual sales of USD 1 million to USD 5 million. They are 241529410001 certified. They list 31 products.",Gum Acacia Soluble Fibre; Adipic Acid,Acacia Fiber; Adipic Acid,suppliers,2026-07-20
1805234,"Khumsub Asia Goods Trading Co., Ltd.",https://www.go4worldbusiness.com/member/view/1805234/khumsub-asia-goods-trading-co-ltd-.html,Thailand,Bangkok,"Phromphan Tower 3, 14Th Floor Unit Number 1410-1414, Lad Phrao Rd. Soi 3, Chom Phon, Chatuchak, Bangkok, 10900, Thailand Bangkok 10900 Thailand",http://www.khumsubtrading.com,NULL,Sukrutai Ninnet,Sales Director,Premium,"July, 2019",yes,Company Registration Certificate Verified,"Khumsub Asia Goods Trading Co., Ltd.",2017,Service Provider,Supplier and Service Provider,290,"Sells Canned fish, canned fruits and dried fruits | Services Sourcing","Khumsub Asia Goods Trading Co., Ltd. is a junior supplier and service provider from Bangkok, Thailand. They are a service provider specializing in canned fish, canned fruits, dried fruits and groceries. They provide services such as sourcing. Founded in 2017, they report annual sales of USD 5 million to USD 15 million. They list 290 products.",Gum Acacia Soluble Fibre; Acai Berry Fruit Extract; Acai Berry Fruit Juice Powder; Acai Berry Fruit Powder; Acerola Cherry Fruit Fibre; Acerola Cherry Fruit Juice Extract; Acerola Cherry Fruit Juice Powder; Adipic Acid,Acacia Fiber; Acai Berry Extract & Products; Acerola Cherry Extract & Products; Adipic Acid,suppliers,2026-07-20
1522145,"S.f.m. International Trading Co., Ltd.",https://www.go4worldbusiness.com/member/view/1522145/s-f-m-international-trading-co-ltd-.html,Thailand,Amphoe Bang Phli,"79/208 Moo 19, Thepharak Road, Tambon Bang Phli Yai Amphoe Bang Phli 10540 Samut Prakarn Thailand",http://www.siamfreshmarket.com,NULL,Nithinunt Botcharoen,Manager,Premium,"October, 2017",yes,Company Registration Certificate Verified,"S.f.m. International Trading Co., Ltd.",2015,Manufacturer/ OEM,Supplier and Service Provider,152,"Sells Fresh vegetables: baby corn, lemongrass and ginger | Services Export","S.f.m. International Trading Co., Ltd. is a junior supplier and service provider from Amphoe Bang Phli, Thailand. They are a manufacturer/oem specializing in fresh vegetables: baby corn, lemongrass, ginger and fingerroot. They provide services such as export. Founded in 2015. They are GMP/HACCP and SEDEX certified. They list 152 products.",Gum Acacia Soluble Fibre; Acai Berry Fruit Extract; Acai Berry Fruit Juice Powder; Acai Berry Fruit Powder; Acerola Cherry Fruit Fibre; Acerola Cherry Fruit Juice Extract; Acerola Cherry Fruit Juice Powder; Acesulfame-K; Agaricus Blazei Murill Mushroom Fungus Fruiting Body Extract,Acacia Fiber; Acai Berry Extract & Products; Acerola Cherry Extract & Products; Acesulfame; Agaricus Extract & Products,suppliers,2026-07-20
1282909,"World Furnitrade Co., Ltd.",https://www.go4worldbusiness.com/member/view/1282909/world-furnitrade-co-ltd-.html,Thailand,Bangkok,"World Furnitrade Co., Ltd. 46/32 Soi Nimitmai 40, East Samwa Sub-district, Klongsamwa District Bangkok 10510 Thailand",https://www.go4worldbusiness.com/member/view/1282909/world-furnitrade-co-ltd-.html,NULL,Nopparat Sangpitak,Owner,Premium,"September, 2014",NULL,NULL,"World Furnitrade Co., Ltd.",2007,Manufacturer/ OEM,Supplier,13,NULL,"World Furnitrade Co., Ltd. is a junior supplier from Bangkok, Thailand. They are a manufacturer/oem specializing in wooden furniture, wood pellet, wood chips and wood sawdust. Founded in 2007, they report annual sales of USD 1 million to USD 5 million. They list 13 products.",Gum Acacia Soluble Fibre,Acacia Fiber,suppliers,2026-07-20
1326966,Charinrat Kamjaroen,https://www.go4worldbusiness.com/member/view/1326966/charinrat-kamjaroen.html,Thailand,Hat Yai,90110 Hat Yai Hat Yai 90110 Thailand,https://www.go4worldbusiness.com/member/view/1326966/charinrat-kamjaroen.html,NULL,Charinrat,Manager,Premium,"May, 2015",NULL,NULL,Charinrat Kamjaroen,2002,Manufacturer/ OEM,Supplier,15,NULL,"Charinrat Kamjaroen is a junior supplier from Hat Yai, Thailand. They are a manufacturer/oem specializing in a4 copy paper, vegetable oil, sunflower oil and soybean oil. Founded in 2002, they report annual sales of USD 250,000 to USD 1 million. They list 15 products.",Gum Acacia Soluble Fibre,Acacia Fiber,suppliers,2026-07-20
4528447,"BBB International Co., Ltd.",https://www.go4worldbusiness.com/member/view/4528447/bbb-international-co-ltd-.html,Thailand,Phon Phisai District,"125 Village No. 12, Na Nang Subdistrict, Phon Phisai District, Nong Khai Province Phon Phisai District 43120 Nong Khai Thailand",https://www.go4worldbusiness.com/member/view/4528447/bbb-international-co-ltd-.html,NULL,Marisa Yiamweha,Ceo,GOLD,"September, 2025",yes,Company Registration Certificate Verified,"BBB International Co., Ltd.",2025,Service Provider,Supplier and Service Provider,1,"Sells Sugar, rice and sunflower oil | Services Trading","BBB International Co., Ltd. is a gold supplier and service provider from Phon Phisai District, Thailand. They are a service provider specializing in sugar, rice, sunflower oil and cashew nuts. They provide services such as trading. Founded in 2025, they report annual sales of USD 1 million to USD 5 million. They list 1 product.",Gum Acacia Soluble Fibre; Acai Berry Fruit Extract; Acai Berry Fruit Powder; Acerola Cherry Fruit Fibre; Adipic Acid,Acacia Fiber; Acai Berry Extract & Products; Acerola Cherry Extract & Products; Adipic Acid,suppliers,2026-07-20
3308743,Baba Thai Group,https://www.go4worldbusiness.com/member/view/3308743/baba-thai-group.html,Thailand,Chonburi,"12 Soi, Bangkok 25/3, Thailand Chonburi 10008 Thailand",https://www.go4worldbusiness.com/member/view/3308743/baba-thai-group.html,NULL,Onanong Tojit,Ceo,GOLD,"May, 2021",yes,Company Registration Certificate Verified,Baba Thai Group,2018,Manufacturer/ OEM,Supplier,116,"Sells Rice, sugar and tuna can","Baba Thai Group is a gold supplier from Chonburi, Thailand. They are a manufacturer/oem specializing in rice, sugar, tuna can and used car parts. Founded in 2018, they report annual sales of USD 250,000 to USD 1 million. They list 116 products.",Gum Acacia Soluble Fibre; Acai Berry Fruit Extract; Acai Berry Fruit Juice Powder; Acai Berry Fruit Powder; Acerola Cherry Fruit Fibre; Acerola Cherry Fruit Juice Extract; Acerola Cherry Fruit Juice Powder; Acesulfame-K; Adipic Acid,Acacia Fiber; Acai Berry Extract & Products; Acerola Cherry Extract & Products; Acesulfame; Adipic Acid,suppliers,2026-07-20
1447885,"Namo Group Co., Ltd.",https://www.go4worldbusiness.com/member/view/1447885/namo-group-co-ltd-.html,Thailand,Bangkok,211/4 Daokhang Road Bangkok 10300 Thailand,https://www.go4worldbusiness.com/member/view/1447885/namo-group-co-ltd-.html,NULL,Anjany Pandey,Manager,Premium,"December, 2016",NULL,NULL,"Namo Group Co., Ltd.",NULL,Manufacturer/ OEM,Supplier,14,"Sells Coir fiber, coco peat and coir peat","Namo Group Co., Ltd. is a junior supplier from Bangkok, Thailand. They are a manufacturer/oem specializing in coir fiber, coco peat, coir peat and coir pith. They list 14 products.",Gum Acacia Soluble Fibre,Acacia Fiber,suppliers,2026-07-20
1489910,"All Organic Co., Ltd.",https://www.go4worldbusiness.com/member/view/1489910/all-organic-co-ltd-.html,Thailand,Bangkok,Bangkok Bangkok 10170 Thailand,https://www.go4worldbusiness.com/member/view/1489910/all-organic-co-ltd-.html,NULL,Phavana S. Phone: Not displayed by user.,NULL,Premium,"June, 2017",NULL,NULL,"All Organic Co., Ltd.",2016,Manufacturer/ OEM,Supplier and Service Provider,2,"Sells Thai herbal whitening toothpaste, Thai herbal deodorant powder and Thai herbal rice milk soap | Services OEM (Create your own brands) and Supplier of all organic Thailand products","All Organic Co., Ltd. is a junior supplier and service provider from Bangkok, Thailand. They are a manufacturer/oem specializing in thai herbal whitening toothpaste, thai herbal deodorant powder and thai herbal rice milk soap. They provide services such as oem (create your own brands) and supplier of all organic thailand products. Founded in 2016. They are Certificate of Products, Origins and Thai FDA approved...",Gum Acacia Soluble Fibre,Acacia Fiber,suppliers,2026-07-20
1691224,"Brom's Cosmetics Co., Ltd",https://www.go4worldbusiness.com/member/view/1691224/brom-s-cosmetics-co-ltd.html,Thailand,Rajthevee,"39/29, Soi Somprasong -3, Phetburi Road, Thanon Phayathai Rajthevee 10400 Bangkok Thailand",http://www.bromscosmetics.com,NULL,Bromchit Khaniyomdee,Managing Director,Premium,"January, 2019",NULL,NULL,"Brom's Cosmetics Co., Ltd",2010,Manufacturer/ OEM,Supplier and Service Provider,4,"Sells Herbal toothpaste, herbal shampoo and machine soaps | Services Shipping","Brom's Cosmetics Co., Ltd is a junior supplier and service provider from Rajthevee, Thailand. They are a manufacturer/oem specializing in herbal toothpaste, herbal shampoo, machine soaps and lotions. They provide services such as shipping. Founded in 2010, they report annual sales of USD 5 million to USD 15 million. They list 4 products.",Gum Acacia Soluble Fibre,Acacia Fiber,suppliers,2026-07-20
3826899,Vorra Thaitrade,https://www.go4worldbusiness.com/member/view/3826899/vorra-thaitrade.html,Thailand,Bangkok,"239/1 Pradu District, Area Bangsue Bangkok Bangkok 10800 Thailand",http://www.vorrathaitrade.com,NULL,Vorrapol Thosaphorn,Chairman,Premium,"January, 2023",NULL,NULL,Vorra Thaitrade,2022,Distributor,Supplier,19,"Sells Dried herbs and herbal powder variety of premium quality, food ingredients and vegetables","Vorra Thaitrade is a junior supplier from Bangkok, Thailand. They are a distributor specializing in dried herbs and herbal powder variety of premium quality, food ingredients, vegetables and butterfly pea and butterfly pea powder. Founded in 2022. They list 19 products.",Gum Acacia Soluble Fibre; Adipic Acid,Acacia Fiber; Adipic Acid,suppliers,2026-07-20
1546271,Cresco Foods,https://www.go4worldbusiness.com/member/view/1546271/cresco-foods.html,Thailand,Bangkok,"75/75 Richmond Office Building 20th Floor, Sukhumvit Soi 26 Khlong Tan Klongtoey, Bangkok Bangkok 10110 Thailand",http://www.crescofoods.com,NULL,Paul Donohoe Phone: Not displayed by user.,NULL,Premium,"February, 2018",yes,VERIFIED Fetching... Verification Status Company Registration Certificate Identity Proof Of Representative Company Address Proof − Trading License − Proof of Prior Export/Import Proof of Product − Company Representative Verified on Video Call − Other Documents like Mandates and Certifications,Cresco Foods,NULL,NULL,Supplier,85,"Sells Avocado, banana (cavendish) and banana flower","Cresco Foods is a verified junior supplier from Bangkok, Thailand. They supply avocado, banana (cavendish), banana flower and cantaloupe. They list 85 products.",Gum Acacia Soluble Fibre; Acai Berry Fruit Extract; Acai Berry Fruit Juice Powder; Acai Berry Fruit Powder; Acerola Cherry Fruit Fibre; Acerola Cherry Fruit Juice Extract; Acerola Cherry Fruit Juice Powder; Acesulfame-K; Adipic Acid,Acacia Fiber; Acai Berry Extract & Products; Acerola Cherry Extract & Products; Acesulfame; Adipic Acid,suppliers,2026-07-20
1441279,Portpro Duct Co. Ltd.,https://www.go4worldbusiness.com/member/view/1441279/portpro-duct-co-ltd-.html,Thailand,Khon Kaen,41/14 Nangkana Chum Phae Khon Kaen 40130 Thailand,http://www.portproduct.net,NULL,Tanakorn,Directing Manager,GOLD,"November, 2016",NULL,NULL,Portpro Duct Co. Ltd.,2015,Buying Agent,Supplier,65,"Sells Fresh fruit, dried fruit and frozen fruit","Portpro Duct Co. Ltd. is a junior supplier from Khon Kaen, Thailand. They are a buying agent specializing in fresh fruit, dried fruit, frozen fruit and fresh vegetables. Founded in 2015, they report annual sales of around USD 250,000. They list 65 products.",Gum Acacia Soluble Fibre; Acai Berry Fruit Extract; Acai Berry Fruit Juice Powder; Acai Berry Fruit Powder; Acerola Cherry Fruit Fibre; Acerola Cherry Fruit Juice Extract; Acerola Cherry Fruit Juice Powder; Adipic Acid,Acacia Fiber; Acai Berry Extract & Products; Acerola Cherry Extract & Products; Adipic Acid,suppliers,2026-07-20
3807269,App Prime Tradings. Co. Ltd,https://www.go4worldbusiness.com/member/view/3807269/app-prime-tradings-co-ltd.html,Thailand,Bangkok,"83/147, Soi Wani, 14/2, Bang Phun, Pathum Thani, Bangkok, Thailand, 12000 Bangkok 12000 Thailand",https://www.go4worldbusiness.com/member/view/3807269/app-prime-tradings-co-ltd.html,NULL,Prawit Chom,Director,Premium,"January, 2023",yes,Company Registration Certificate Verified,App Prime Tradings. Co. Ltd,1992,Manufacturer/ OEM,Supplier,13,"Sells Sugar, sunflower oil and rice","App Prime Tradings. Co. Ltd is a junior supplier from Bangkok, Thailand. They are a manufacturer/oem specializing in sugar, sunflower oil, rice and fresh garlic. Founded in 1992, they report annual sales of USD 1 million to USD 5 million. They list 13 products.",Gum Acacia Soluble Fibre; Acesulfame-K; Adipic Acid,Acacia Fiber; Acesulfame; Adipic Acid,suppliers,2026-07-20
1563689,Thapsakae Coconut Products,https://www.go4worldbusiness.com/member/view/1563689/thapsakae-coconut-products.html,Thailand,Prachubkirikhan,310/1 Thapsake Prachubkirikhan 77130 Thailand,https://www.go4worldbusiness.com/member/view/1563689/thapsakae-coconut-products.html,NULL,Dumrongkiat Phone: Not displayed by user.,NULL,Premium,"April, 2018",NULL,NULL,Thapsakae Coconut Products,NULL,Manufacturer/ OEM,Supplier,2,Sells Coconut fiber and coconut peat,"Thapsakae Coconut Products is a junior supplier from Prachubkirikhan, Thailand. They are a manufacturer/oem specializing in coconut fiber and coconut peat. They list 2 products.",Gum Acacia Soluble Fibre,Acacia Fiber,suppliers,2026-07-20
1340580,Supannee Trading Limited Partership,https://www.go4worldbusiness.com/member/view/1340580/supannee-trading-limited-partership.html,Thailand,Bangkok,"5/3 Mu, 1 Thung Song Hong Lak Si Bangkok 90500 Thailand",http://www.supanneethongmanpcl.com,NULL,Thaigwan Jaar,Manager,Premium,"July, 2015",NULL,NULL,Supannee Trading Limited Partership,NULL,Manufacturer/ OEM,Supplier,24,"Sells Energy products, dairy products and animal feed","Supannee Trading Limited Partership is a junior supplier from Bangkok, Thailand. They are a manufacturer/oem specializing in energy products, dairy products, animal feed and oil seeds. They list 24 products.",Gum Acacia Soluble Fibre; Acesulfame-K,Acacia Fiber; Acesulfame,suppliers,2026-07-20
887114,"Spice Solution Co., Ltd.",https://www.go4worldbusiness.com/member/view/887114/spice-solution-co-ltd-.html,Thailand,Bangkok,1197/137 The Parkland Tower4 7Fl. Bangkok 10100 Bangna Thailand,https://www.go4worldbusiness.com/member/view/887114/spice-solution-co-ltd-.html,NULL,Alex,General Manager,Premium,"April, 2010",NULL,NULL,"Spice Solution Co., Ltd.",2010,Distributor,Buyer,1,"Buys Cinnamon, clove and cardamom","Spice Solution Co., Ltd. is a junior buyer from Bangkok, Thailand. They are a distributor for cinnamon, clove and cardamom. Founded in 2010. They list 1 product.",Gum Acacia Soluble Fibre,Acacia Fiber,suppliers,2026-07-20
3264311,"Jumbo Trading Co.,Ltd",https://www.go4worldbusiness.com/member/view/3264311/jumbo-trading-co-ltd.html,Thailand,Phrakanong,"4388/1 Soi Farmwattana, Rama4 Road, Mob. +66631967573, +66818363785 Phrakanong 10110 Bangkok Thailand",http://www.jumbo.th.com,NULL,Sagid,Manager,Premium,"March, 2021",NULL,NULL,"Jumbo Trading Co.,Ltd",1994,Manufacturer/ OEM,Buyer and Supplier,NULL,"Sells Gum Arabic, Arabic Gum and Acacia Senegal | Buys Milling Machines","Jumbo Trading Co.,Ltd is a junior buyer and supplier from Phrakanong, Thailand. They are a manufacturer/oem specializing in gum arabic, arabic gum, acacia senegal and acacia seyal and cotton. They are a manufacturer/oem for milling machines. Founded in 1994, they report annual sales of USD 1 million to USD 5 million.",Gum Acacia Soluble Fibre,Acacia Fiber,companies,2026-07-20
3847304,Great Land Corp. Ltd.,https://www.go4worldbusiness.com/member/view/3847304/great-land-corp-ltd-.html,Thailand,NULL,- - Thailand,https://www.go4worldbusiness.com/member/view/3847304/great-land-corp-ltd-.html,NULL,Gajita Thanachayapat Phone: Not displayed by user.,NULL,Premium,"February, 2023",NULL,NULL,Great Land Corp. Ltd.,2023,NULL,Supplier,NULL,Sells Acacia Wood,Great Land Corp. Ltd. is a junior supplier from Thailand. They supply acacia wood. Founded in 2023.,Gum Acacia Soluble Fibre,Acacia Fiber,companies,2026-07-20
1680774,Thai Acrylic Fibre Co. Ltd.,https://www.go4worldbusiness.com/member/view/1680774/thai-acrylic-fibre-co-ltd-.html,Thailand,Bangkok,Thailand Bangkok Thailand,https://www.go4worldbusiness.com/member/view/1680774/thai-acrylic-fibre-co-ltd-.html,NULL,Ashwini Phone: Not displayed by user.,NULL,Premium,"January, 2019",NULL,NULL,Thai Acrylic Fibre Co. Ltd.,NULL,NULL,Supplier,NULL,Sells Acrylic fibre,"Thai Acrylic Fibre Co. Ltd. is a junior supplier from Bangkok, Thailand. They supply acrylic fibre.",Gum Acacia Soluble Fibre; Acerola Cherry Fruit Fibre,Acacia Fiber; Acerola Cherry Extract & Products,companies,2026-07-20
3630421,"The Plus Power Co.,Ltd",https://www.go4worldbusiness.com/member/view/3630421/the-plus-power-co-ltd.html,Thailand,NULL,- - Thailand,https://www.go4worldbusiness.com/member/view/3630421/the-plus-power-co-ltd.html,NULL,Ukkrit Palachote Phone: Not displayed by user.,NULL,Premium,"May, 2022",NULL,NULL,"The Plus Power Co.,Ltd",2022,NULL,Supplier,NULL,Sells Acacia And Eucalyptus Wood Chips,"The Plus Power Co.,Ltd is a junior supplier from Thailand. They supply acacia and eucalyptus wood chips. Founded in 2022.",Gum Acacia Soluble Fibre,Acacia Fiber,companies,2026-07-20
3391764,World D Trading,https://www.go4worldbusiness.com/member/view/3391764/world-d-trading.html,Thailand,NULL,Thailand - Thailand,https://www.go4worldbusiness.com/member/view/3391764/world-d-trading.html,NULL,Arnon D Phone: Not displayed by user.,NULL,Premium,"August, 2021",NULL,NULL,World D Trading,2021,NULL,Supplier,NULL,Sells Damar batu,World D Trading is a junior supplier from Thailand. They supply damar batu. Founded in 2021.,Gum Acacia Soluble Fibre,Acacia Fiber,companies,2026-07-20
3314071,"Jumbo Trading Co., Th",https://www.go4worldbusiness.com/member/view/3314071/jumbo-trading-co-th.html,Thailand,Bkk,4388/1 Soi Framwattana Rama 4 Bkk 10110 Thailand,http://www.jumbo.th.com,NULL,Kiran,Global Marketing,Premium,"May, 2021",NULL,NULL,"Jumbo Trading Co., Th",2000,Manufacturer/ OEM,Supplier and Service Provider,NULL,"Sells Gum arabic, cotton and pigeon pea | Services Distributors","Jumbo Trading Co., Th is a junior supplier and service provider from Bkk, Thailand. They are a manufacturer/oem specializing in gum arabic, cotton and pigeon pea. They provide services such as distributors. Founded in 2000, they report annual sales of USD 15 million to USD 25 million. They are Halal certificate, Kosher certificate and Thai FDA Certificate certified.",Gum Acacia Soluble Fibre,Acacia Fiber,companies,2026-07-20
4688219,Palm,https://www.go4worldbusiness.com/member/view/4688219/palm.html,Thailand,NULL,- - Thailand,https://www.go4worldbusiness.com/member/view/4688219/palm.html,NULL,Palm Phone: Not displayed by user.,NULL,Premium,"April, 2026",NULL,NULL,Palm,2026,NULL,Supplier,NULL,"Sells Young dried betel nut, olibanum and myrrha gum","Palm is a junior supplier from Thailand. They supply young dried betel nut, olibanum, myrrha gum and aloe gum and many other herbs.. Founded in 2026.",Gum Acacia Soluble Fibre,Acacia Fiber,companies,2026-07-20
